subset,id,questionText,clusters
reddit,124,Does anything spawn in Rancho besides coffee and sugar?,"[['Romeros usually had crowbars', ""Ranchito holds fertilizer, crowbars, axes, MRE's, crossbows, recurve bows, twine, backpacks"", 'Romeros does not spawn axes and crowbars and food and water anymore'], ['Shotgun and shells'], ['There wasnt any there a single time', 'Most of the loot in rt is broken since months'], ['Zombies'], ['Check the office buildings for ammo'], ['It spawns in Cranberrys'], ['PV is the only feasible place to get ammo'], ['It spawns in residential filing cabinets and drawers as well'], ['Ranchito actually has the same amount of car spawns as PV does']]"
reddit,125,[Suggestion]Right mouseclick on certain mountable creatures uses a special attack   Sarco: [on/in water]Deathroll [on/in land] grab or snare creatures(to  drag into the water      Bronto: STOMP      Megalodon: jump attack [like this](https://youtu.be/uRChY7uzvSg)      and much more      what do you guys think of these?,"[[""The shark can't take the rivers inland""], ['For birds and pteranodons, this alt attack (right mouse) will pick up a player (only tribe mates in pve)'], ['I am a sarco fan'], ['I am unsure how to keep my sarco safe'], ['I have this plan to tame a plesiosaur and live in the seas with my sarco'], ['I want to use sarcos after they fix sarcos under water turning'], ['If I need land materials I will take my sarco out to the shore and harvest stuff'], ['Sacro should have a deathroll while in water deep enough to swim in'], ['The idea of the bronto and mega ones is good', 'grab creatures and drag them in water is extremely awesome', 'bronto stomp is extremely awesome'], ['The sarco has good utility'], ['This is the alt-attack that they speak of'], ['they are thinking of turning the saber jump attack into an alt attack as well'], ['time to plan my armada'], ['For the T-Rex, as of today, this will cause it to roar'], ['I wish I could ride my megalodon, red October'], ['I wish I could jump up out of water and roar'], ['hould give off a fear effect']]"
reddit,126,"/r/hockey Charity Bracket Challenge (Round 2)   We need to work on a bracket for /r/hockey's charity bracket challenge. We'll be entering one bracket as a whole, so we'll need to agree on one.      Each series will be posted in the comments, upvote the winner of the series and the amount of games that the series will go to.       The most upvoted winners will be selected for our bracket.      I will submit a new thread for round 2 around 6:30PM (that's this thread), round 3 (tomorrow at 9am) and the cup finals (tomorrow at 1pm).       We also need to choose a charity, so we should discuss that in the comment section of this thread as well.      [Here is a link to the thread](http://www.reddit.com/r/hockey/comments/32hacv/2015_rhockey_playoff_charity_challenge/)      # Link to each voting thread      * [New York Rangers vs Washington Capitals](http://www.reddit.com/r/losangeleskings/comments/32ihtb/rhockey_charity_bracket_challenge_round_2/cqbilv4)   * [Montreal Canadiens vs Tampa Bay Lighting](http://www.reddit.com/r/losangeleskings/comments/32ihtb/rhockey_charity_bracket_challenge_round_2/cqbil2h)   * [Anaheim Ducks vs Calgary Flames](http://www.reddit.com/r/losangeleskings/comments/32ihtb/rhockey_charity_bracket_challenge_round_2/cqbijut)   * [Chicago Blackhawks vs Minnesota Wild](http://www.reddit.com/r/losangeleskings/comments/32ihtb/rhockey_charity_bracket_challenge_round_2/cqbiiud)      Also there's still time to vote on the series game numbers on the old thread. So you can still vote on that. http://www.reddit.com/r/losangeleskings/comments/32hnzz/rhockey_charity_bracket_challenge_round_1/      # Charity Vote      * [Charity Voting Thread](https://www.reddit.com/r/losangeleskings/comments/32hnzz/rhockey_charity_bracket_challenge_round_1/cqbas55)","[['Anaheim Ducks will win the series'], ['Chicago Blackhawks will win the series'], ['Minnesota Wild will win the series'], ['Calgary Flames will win the series'], ['Montreal Canadiens will win the series'], ['Tampa Bay Lightning will win the series'], ['Washington Capitals will win the series'], ['New York Rangers will win the serie']]"
reddit,127,"Complete noob here. Any advice welcome!   I've always been responsible when it comes to my money. In the sense that I dont spend what I dont have, I save my money, and I watch what I spend.   But now I've recently graduated (with 28k in debt) and want to do better. I've got, what I think, is a decent plan to pay off my debt. (I think it was the avalanche model or something. I'd put the majority of my payments to the high interest rate while paying minimum on the low interest rate to get it out of the way first.)      But what else should I be doing? Everytime I look at a post about funds, indexes, stocks, ect I feel so lost. Like I missed the class where everything was explained and am now just trying to jump into an exam.","[['The best way to learn is to check out the FAQs on the sidebar, or just read through some of the previous posts in this form from the top page', 'I thought 401k was supplied by a business and Roth was an individual doing their own thing', ""It's hard to know what your savings needs would be for starting a small business."", 'You should read the information found in the FAQ', ""Whether a Roth IRA/401k is a good idea is a judgment you have to make based on your current tax bracket and where you feel you'll be in retirement."", ""You may find 'Your 401k and You: Basic Information' worth a read"", ""You may find 'Your IRA and You: Basic Information' worth a read"", 'An IRA, or Individual Retirement Account, is a retirement account you can open yourself', 'You have the advantage of recognizing your own lack of knowledge and are going about fixing it', 'A good 90% of your classmates have the same level of knowledge (or less) you do', ""You should read 'I Have $[X] ... What Do I Do With It?!'"", 'There was never a class where this was explained', 'I was planning on trying to start my own business', 'Most people have traditional 401ks', 'We can help if you have any specific questions, or if there is something specific you want to learn more about and want to find good resources (buying a house, buying index funds, etc)', 'Invest in pumpkins', 'You should read the Long-Term Investing Start-Up Kit', 'The two common retirement accounts are 401ks and IRAs', 'A 401k is a retirement plan that employers provide their employees', 'With a Roth IRA, you would just contribute money from your bank account', '401ks and IRAs can be a Roth account', '401ks and IRAs can be traditional', 'My confusion stems from not knowing the difference between a Roth and a 401k', 'Is a roth retirement plan what I should be looking at'], ['I LOVE pumpkins'], [""I would prioritize paying off debt before trying to fund a small business unless your small business doesn't require much cash to start.""], [""I'd put the majority of my payments to the high interest rate while paying minimum on the low interest rate to get it out of the way first.""], [""My business doesn't need much start up cash at all""], ['You should also save up some cash in a bank account and consider that your emergency fund.'], ['pumpkins will pay out year round'], ['After you have paid down your debt and have a healthy emergency fund, then you can invest for retirement.'], ['Any extra money should go towards the principal'], ['I want to get to a place in my debt to where I feel I will financially be able to handle starting my business up without worry'], ['If your employer matches your contributions to a company 401k retirement plan, then you should start making 401k contributions right away.']]"
reddit,128,"Mentally Handicapped and Religion   I just wanted to share something I've noticed at my new job and was wondering if anyone else noticed this/had thoughts about this.      There are a few retarded people that work the mail room at my job.  Every once in a while I'll see them alone in a corner slowly reading the bible out loud to themselves.  I can bet most people passing that scene think it's a testament to god's glory.  But, there's something about it that really rubs me the wrong way.  Like someone who has been ""given"" a poorly functioning brain is supposed to read about the gnarly stuff in the bible and totally believe it? That's terrible.      Or is it actually a good thing to convince mentally retarded in the existence of an afterlife to feel a sense of vindication at the bad hand they've been dealt in their lives?","[[""A nice make believe story doesn't do anything real to help the situation"", 'They have it difficult enough in life', ""They can't be free to choose their own beliefs because they are mentally disabled"", 'Everyone would like a nice make believe story to feel better in difficult times', 'It is ok if those people hope to live a better life some day', 'You could hand them the Quran or any other religious text and achieve the same thing', 'churches across the US are filled with mentally retarded people every Sunday', 'Very little can help the situation as of now'], [""big religion is used by those in power to ensure a large population of uneducated 'sheep'"", 'It was a good way to keep the slaves in the early US quiet and compliant', 'the church has a problem with birth control'], ['I do not believe in god', 'I cannot understand how intelligent people do believe'], ['I find this post to be in extremely poor taste'], ['Many of the children with Aspergers Syndrome and Autism do not believe in God'], ['I rescind my comment']]"
reddit,129,"Saw Avengers: Age of Ultron on Friday   I saw Age of Ultron on Friday, and he makes a good point:       Ultron: Everyone creates the thing they fear. Men of peace create engines of war. Avengers create invaders. **Parents create children, that will supplant them.**      Ha. Never thought of it like that. Even fictional robots don't like kids!","[['That was about her past being trained as an assassin', ""Black Widow considers herself broken because she's sterile"", 'she was forced to be sterile', ""The 'monster' quote probably means she's good for assassinations and nothing else""], [""they don't have to worry about little hulks running around""], [""Calgary or Toronto are not 'nearby' to Winnipeg"", 'the closest one to me is either Calgary or Toronto'], ['I found myself identifying with Ultron more than any of the other characters'], ['Not a kid under 14 is in the theater at Alamo-Drafthouse', 'I went to the 11pm time'], ['If anyone felt broken there, it was Banner'], ['Natasha was 100% okay with being Auntie Nat'], ['That was Natasha consoling Banner more than anything'], ['A movie that attracts a lot of kids has many children in the audience'], ['Humans make smaller Humans', 'Smaller people'], ['Movie was great']]"
reddit,130,"LP Papas Fritas Pre-Punched?   Hey!  I just scored a tin of Papas from CBid and oddly enough, they do not have the pig tail like you see everywhere.  Instead, they are all pre-punched, like 7 or 9mm.  Has anyone else heard of pre-punching cigars before distribution?  Sure, it makes it convenient like a cigarette, just pull out of the tin and light up, but it seems off to me.  Did someone just re-cello and send me used/altered cigars?","[['I am going to do a more thorough inspection after work'], ['that may be what you are seeing', 'the pig tails broke', 'the tails just turned to dust at some point in their cellophane life', 'I am hoping that is what the issue is'], ['I have never seen that before', 'I have definitely never had that problem'], ['I will just start ordering elsewhere from now on'], ['You should email cbid to see if they will exchange them', 'I would definitely contact Cbid', 'I would definitely put a call into cbid', 'Cbid will replace or refund them', ""Don't write cbids off quite yet""], ['There are no pig tail parts in the cello', 'there are definitely no discernible tail parts'], ['You should message one of the DE guys on here or email them from their website'], ['there was some dust in the package'], ['there would be a hole left behind'], ['All four are like that']]"
reddit,131,"Lease question   My lease was up in March. I was sent a lease renewal and lost it. I called the management company to have them send another agreement but they never did. So, any ideas what the terms may be? Is it month-to-month since a renewal was never signed? I'm considering looking for a new place and thought the brilliant minds at r/chicago my have some insight.    Thanks!","[['They are allowed to roll the lease over without me signing another', 'You should call them', 'Most all housing leases will have provisions for when the contract ends', 'only in rare occasions does an auto renewal occur', ""If it doesn't state t, then you're on a month to month agreement"", 'Best idea is to get a year lease signed sooner rather than later', 'You should check your current lease to see if there are any provisions for such term and condition', 'It defaults to month-to-month in your case', 'you should go to their office and get a new lease', 'in the state of Illinois you are automatically on a periodic term, with that term being month to month', ""You should double check to make sure they didn't somehow roll your lease over"", 'you should bring the copy of your lease, proof that you have paid rent since March'], ['they could decide to bump the price up and get someone else in there who will pay it', 'You only have to give a 30 days notice', ""there's a danger on your end that they can give YOU thirty days' notice as well and rent your place out to someone else"", ""if you haven't signed a new lease after your current one has come up, in the state of Illinois you're automatically on a periodic term, with that term being month to month""], ['someone would try it'], ['they would have to prove it'], ['I highly recommend checking out http://www.illinoislegalaid.org/ for legal questions'], ['a lease literally takes ten minutes to write up']]"
reddit,132,"Welsh on Duolingo on Memrise   While we're waiting for Welsh to make it into the Incubator, Team Cymru has been developing the first lessons and now we're putting them onto Memrise for anyone to try out.      Take a look and tell us what you think.      http://www.memrise.com/course/741040/welsh-course-on-duolingo/","[[""It'd be 'yng Nghymraeg'"", ""It's 'yn Gymraeg'""], [""The statement saying that you are an actor (actor dych chi) says 'and' instead of 'an'""], [""it'd be best broken up into skills like the trees currently are""], ['What I want to learn when learning a new language are things like hello and goodbye, and please and thank you', 'Hello and goodbye comes soon', 'I find the selection of vocabulary a bit odd', 'We are trying to follow the vocab used in Duolingo courses', ""some of the word choices aren't really following the Duolingo format""], ['The question asking if you are an actor (athro dych chi?) seems to be asking if you are a teacher', 'Not actress or teacher'], ['Thanks for the feedback'], ['Welsh is something to be excited about', 'I will be so excited when there is a course in Duolingo', 'I have always wanted to learn Welsh']]"
reddit,133,"If King Piccolo gives birth to dinosaur-like creatures (""mutated namekians"") because he's a warped demon, how come he was also able to give birth to a regular Namekian (Piccolo Jr./DBZ Piccolo)? Shouldn't Piccolo also have been some dinosaur-like mutated Namekian?   I understand this is probably a retcon because Toriyama had not yet thought of the concept of Namek/Namekians at this point, but are there any non-retcon theories to this? How did Piccolo Jr. end up being a regular Namek instead of a mutated dinosaur-like creature like all of King Piccolo's other children?","[[""At first Picolo wasn't conceived as extraterrestian""], [""Picolo Jr wasn't just his child, he was his reincarnation"", ""Piccolo Jr. doesn't really even look like King Piccolo"", 'He is his reincarnation', 'Those are regular sons of Guru, not his reincarnations', ""Piccolo is not simply just another one of Daimao's children"", ""junior isn't his child""], [""It's a bit more complicated""], ['Some namekians have the facultie to create mutant beings', 'Nameks can control how their off-spring look', ""Picolo Daimao's demonic sons like Tambourine, Timbal, etc."", 'Namek can sort of control how their offspring look'], [""Piccolo didn't make loads of them later on and train them all""], ['Piccolo Jr. was so damn good'], ['creating them took life energy'], ['it may have not been worth it for King Piccolo to train with Tambourine']]"
reddit,134,"List of all players who make Videos   Hey,      Jeff just asked me for a list of all the Players who make Videos from Events like Calamity.      If you make Videos of those, please post your Ingamename + Youtube-Channel here!       Thanks :D","[['JSano19 is at http://www.youtube.com/user/JSano19'], ['Jeff probably knows his own yt channel'], ['I would most likely be at all events'], ['p00p0nface is at www.youtube.com/user/p00p0nface'], ['specialbreh is at http://www.youtube.com/user/specialbreh'], ['You are asking if we have made videos of those events', 'You are asking if we are willing in the future', 'http://www.youtube.com/user/QuisnamOfGallifrey will be uploading LPs and such soon']]"
reddit,135,What! ESO going sub free?   When did this happend? Haven't played since late September.,"[['Millions of people decided not to purchase the game due to not wanting to pay a monthly fee', ""Maybe they weren't doing as well with subs on PC as they had hoped""], ['Xbox does not allow subscription games on it', 'It is 100% due to Microsoft'], ['Zenimax made the decision to drop it'], ['PC and PS4 players should be charged with a subscription', ""They're charging for all DLC anyways"", ""You'll effectively be paying a subscription if you want to enjoy updates"", 'Xbox players should have it BTP but with some more limitations on the gameplay that you have to pay for'], ['ESO is going B2P starting March 17th 2015'], ['I am truly happy'], ['I can search for answers to various questions at will somewhere on the Internet'], ['I think they were doing alright'], ['It launches on consoles June 9th'], ['Microsoft never agreed to that'], ['PS+ would not be required for ESO'], ['Sony was happy to play ball and made their decision before the PC version ever launched'], ['America has a black president'], ['redguard president']]"
reddit,136,ES/nova or Nova/orb sorc?   I've made all the cookie cutter sorc builds before and I wanted to try out something new. Has anyone ever made these builds before or knows of a good guide to follow?,"[[""You'll end up doing way more with that than you would with even a spirit + crescent moon"", 'It would be fun to play', ""when looking for non-cookie cutter builds, there generally aren't guides"", 'None go max block with a spirit or even lidless', 'in solo games, nova orb plays like an orb sorc but you also have nova for clearing fodder mobs', '200 fcr is pretty nice', ""I can't count the number of times I've had to go clear the bodies of friends running the infinity self-wield setup where they got smashed by weak mobs"", ""sorc are 'glass cannon' whereby let the merc hold infinity where the monsters are in range of its aura and stand back and zap them"", 'ES sorc is only viable for pvm if you stack pdr/mdr', 'the infinity self-wielding sorc is not favorable', 'self wielding has too much flaws', 'nova-baller needs top end gear to even be efficient at solo games', 'A sorc wielding an infinity is also pretty fun', ""The tipping point is somewhere between -25 and -45 where you're going to be better off overall with more real damage"", 'ES plus mana-burn is undesirable', 'having a decent amount of -elr equipment is important on a light sorc', 'They should be fun to cow with', 'nova-baller is about as much fun as you can have on a sorc', 'Do a frost nova sorc', 'ES nova is your best bet if you want something a little different', 'cm build is the right balance of -elr and raw damage', ""there comes a point where enough is enough and you're really not gaining considerable damage against broken immunes"", ""It wouldn't be efficient to farm with one"", ""Your OPINION is that CTA isn't worth it"", 'Sorcs are still glass cannon characters regardless', 'You might lose so much raw damage', 'A 25% chance to block is better than a 0% chance to block', ""you are suggesting an inferior setup to someone who isn't interested in the build in the first place"", 'nova orb is generally weak', 'An ES/nova sorc with infinity would be fun', 'a light sorc is not something new just because you put on an inferior weapon that is better off being used by your merc in all regards', ""you'd be daft to do that to a pack of frenzytaurs (many of which are so mean you have to tele back to keep your merc from biting it, even with your ebug forti/eandies)"", 'You run out of reasons to argue your point', 'nova damage has been nerfed quite a bit', 'I will be looking for some Bers to make myself an infinity', ""I can't justify trading an extra 37 skill based -enemy resist for a little bit of life/mana/stamina""], ['Nova sorcs for cows were more viable in .09'], ['elr is nice to have, but its not everything'], ['the old school eschuta build kills hell baal faster even than crescent moon build'], ['there are a lot of mobs you can telestomp and cbolt/nova'], ['you can get away with 1 point es if you still have decent resists']]"
reddit,137,"How would you guys feel if Heimer had no turrets anymore?   Let say that with his ""rework"" heimer had no turrets anymore,how would you feel about it?","[[""The rework didn't change that""], ['The subject would probably still be less disappointing than the Karma rework'], ['The trundle rework was minimal'], ['his ult is actually good now'], ['I like amumu and poppy'], ['I miss the CC reduction on his W'], ['Heimerdinger is the mechanic of the yordles'], ['The reworks changed Frozen Kingdom (previously Contaminate)'], ['Mecha minions which work like promoted ones so you get their gold'], ['I would like Heimerdinger to actually have only 1 damage spell and the rest like building stuff he can place on the map which do things for him']]"
reddit,138,"I need to kick my gurps game up a notch, anybody here want to do a 30 seconds worth of  voice-work/sound-work for me for nothing but my eternal gratitude?   I'm currently running a GURPS game I call World War 2.0.  I know nothing about sound design or sound editing or foley art or whatever the technical term is for what I want.  Would somebody out there be willing to read a few lines and then do some voice changing for me?","[['I would be up for that', ""I'm more than game to do voices"", 'I am game', ""I'm more than happy to try my hand.. er voice at whatever you need"", 'I can do the reading for you', ""give me some lines and I'll read them for you""], ['You should try looking for a voice acting forum and advertising in there'], ['it really depends on what changes you are looking for'], ['I am British'], ['I can do some sound editing'], [""it would be pretty awesome if we could do this on a regular basis for everyone's games""], ['I have no experience']]"
reddit,139,"Got shade, but want to grow veggies?   This popped up in my daily Park Seed email, figured I'd share it as a quick reference:      In sites with 4 to 5 hours of sun a day, you can grow . . .   Beans, especially the bush varieties   Peas | Carrots | Potatoes | Beets | Turnips | Radishes      In sites with 3 to 4 hours of sun a day, you can grow . . .   Lettuce | Arugula | Spinach | Salad Burnet | Sorrel | Cornsalad | Cabbage | Broccoli | Kale | Mustard | Pak Choi | Swiss Chard      And in sites with just 3 hours of sun a day, you can grow . . .    Parsley | Chives | Oregano | Mint | Cilantro","[[""I would hate for someone to plant a ton and then cry in 3 months when it's time for harvest""], [""It's doable to grow spinach in San Diego""], [""The mint didn't mind"", 'Many herbs grow great in the shade', 'My mom would always plant mint under her trees'], ['using a mirror to catch the sun is starting to show results', ""I was really frustrated with last year's harvest"", 'I am desperate to try anything', 'using a mirror to catch the sun adds about three more hours of sunlight', 'the only way for me to get enough light to my starters is to use a mirror to catch the sun'], ['Plant in early spring or in late summer/early fall for an over-winter'], ['The subject is cooking with flowers'], ['Some edible flowers, like violets, prefer shade and make for a gorgeous salad', 'You can eat violets'], ['kale and its friends require cold weather to be tasty'], ['4 to 5 of sun is not shade'], [""you can get by with a lot less sun if you aren't looking for the biggest most beautiful produce around""], ['Even tomatoes will grow in less sun'], ['I have to relocate my vegi garden'], ['I know what to use my old space for'], ['Tomatoes need FULL SUN', 'I may still set up a series of mirrors to redirect light for some of my more needy veggies'], ['Beets, radishes and carrots have all thrived for me in partial sun (~8hrs)']]"
