subset,id,questionText,clusters
reddit,61,Kyle Rudolph. Time to give up?   He was great at the beginning of the year but they seem to have forgotten him in their offence.      I actually really liked him earlier in the year.      What to do?,"[['You can count on Rudolph to get more looks', 'he will see more targets this week', 'Rudolph will probably be the first person Ponder will look to in the passing game'], ['This team needs a win to keep themselves playoff relevant in a tough division'], [""I'm not sure if that's saying much""], ['he was actually very impressive'], ['he is on the verge of losing his bench spot', 'I have given up on him', 'I am dropping the player for the tight end in Oakland', 'they are having Rudolph block more', 'I dropped Rudolph yesterday for Dreessen', 'I would need to see some consistency before I would ever start him again', 'two weeks over zero catches in 3 is a lot of blocking'], ['Carson Palmer throws to Brandon Myers a lot', 'Carson Palmer can actually throw it to Brandon Myers'], ['I am forced to use him this week due to byes']]"
reddit,62,one more 980ti or wait for new nvidia cards?   so sli 980ti or wait for new nvidia gpus?,"[[""I don't think at the end of the day its worth it unless potential $$ is more important than current enjoyment.""], ['There is a huge current performance loss.', ""It won't be enough at times"", ""OP won't get the performance OP wants with just one card"", ""You will need to be running SLI 980 Ti's to run games on maxed settings 1440p and 144fps"", 'Going from a 980 Ti to a 7850 on a 1440 144hz will be extremely jarring.', 'You are going to lose on the margin on 2 cards as well as paying shipping for them.', 'Go for it', 'I want to have more power', 'You wont be able to get 144 fps across the latest games completely maxed out'], ['Going for the next Titan is not the worst idea'], ['I am contemplating selling my G1 970 to buy a 980ti matrix'], ['I recommend waiting', 'Used ones will be a lot cheaper as early adopters dump theirs', 'Wait until Nvidia keynote (GTC) in two weeks', 'I would just wait', 'I am waiting for the new cards to get a second 980Ti cheap'], ['I have to question why you would need/spend the money on quad-SLI Titans in the first place'], ['I went for a 980ti'], ['It is 40$ more on a bigger ssd'], ['It is 40$ more on another pc part'], ['My 1gb 7850 runs 1440p just fine'], ['Pascal is on my mind also'], ['Play on Intel HD'], ['That is 40$ of beer'], ['X80 will not be a game changer compared to 980 Ti'], ['You can buy the best one'], ['You should sell the one 980 Ti you have'], ['You will have to deal with SLI inconveniences and scaling issues', 'sli is not problem free'], ['nVidia will have to drop the price more than that'], ['""$40 cheaper"" can\'t wait'], ['390 maintain its value better.'], ['A 7850 cannot even run Dota 2 at 60 fps at 1440'], [""A 7850 is fine if you don't play graphically intensive games""], [""There is no reason to have Titans if you don't play graphically intensive games""], ['The lowest card he should downgrade to is probably a 390.'], ['You should buy the best one when it comes out'], ['You will not keep the cards past mid 2017 at the latest']]"
reddit,63,Show armour rating on mouse over like swords do damage rating.   That includes what different protection enchantments add and whether or not things like fire protection make you invulnerable to fire damage at the amount you have.,"[['they should already have this', 'The tooltips for armor would be a LOT more difficult to make than those for swords', 'All armor should have shown armor values', 'They could as well have Diamond chestplate', 'Maybe the min-to-max instead of the average', 'It would be iffy for enchantments', 'It would be pretty similar to this', 'Min to max is easy enough to understand', 'they could do the same for armor'], ['Mojang would be able to work something out in the end if they tried'], ['They could as well have Diamond sword'], ['What I said applies to the standard Protection enchantment']]"
reddit,64,whats the current status of scrub and raid 5 and 6?   still not working or do the newest versions have a supposedly working implementation?,"[[""The Warning is probably just that the usage tool can't display accurate free space on raid5/6 yet""], [""there's info rot on the Wiki""], ['It works'], ['no errors on scrub and the files are fine', 'Scrub is working'], ['the metadata is not spread over all 3 drives', ""all the data isn't in raid 5"", 'Metadata is in RAID1 so it keeps 2 copies', 'If you want to spread it over all drives, convert it to RAID5', 'The drives for the metadata are chosen', 'The metadata was raid1 the whole time'], [""After that completes you will have data and metadata RAID5'd""], ['The speed difference is noticeable'], ['What you need to do is change the metadata RAID level and rebalance'], ['You can continue to use the array while it balances'], ['You only have data set to RAID5'], ['metadata should be set to 5 too'], ['Data and metadata RAID levels are chosen independently'], ['Dedup has nothing to do with your RAID level'], ['I am back to raid10 after adding another hard drive'], ['I will set the metadata to raid5'], ['RAID56 detected, not implemented']]"
reddit,65,"Will UPS require signature for Google play orders?   I tried chatting with GP support, but I keep getting directed to other pages.  They must not want to chat with all the ""where is my Nexus 6?!"" requests.      Does anyone know if UPS usually requires a signature for Google play device orders?  If so, I may need to change my order to ship to work instead of my house.","[[""You can choose what's best""], ['You can choose for free to have a package held at the nearest sorting facility', 'Once you get your UPS tracking number you can contact UPS to manipulate your delivery if needed', 'UPS My Choice might work as well', 'You may be able to reroute your package if you are a UPS My Choice member and you live in the United States', 'My recommendation is to be home or have the location changed to a UPS location to be picked up', 'You can just pick the package up instead of waiting all day for the truck to arrive', 'You can have the package held at the UPS facility with UPS My Choice'], ['UPS will be shipping'], ['You cannot change your order shipping address'], ['You could support reddit too'], ['they will simply leave it at your door', 'Release without signature is up to the driver', ""There is, seemingly, no rhyme or reason when they leave and when they don't""], ['you can go online via your tracking number and submit an e-signature'], ['I am not even sure I have a tracking number yet'], ['If you want it delivered to the nearest UPS store then it costs about $5'], ['It works for Google play orders'], ['On your tracking page there should be a link to create an UPS my choice account'], ['Reddit gold comes with a UPS My Choice premium trial that would give you more options'], ['I got this answer from the corporate office last year when the driver would not leave my Nexus 5 order despite being a MyChoice member with signature release on file'], ['It still says ships by 11/21'], ['It will require a signature']]"
reddit,66,"So I'm starting to learn Diana, and I had a question...   When using her ult (Lunar Rush), will Diana travel through enemies or hazards or does she blink?  For example, if the linear path from Diana to a minion had an Ezreal ult in between them, would traveling ""through"" the path of the Ez ult deal damage to Diana?","[['There are very few blinks in the game', 'Warwick, Twisted Fate, Shen, and Pantheon have not so usual blinks', 'Ezreal, Fizz, Kassadin, Katarina, Talon, Lissandra, Maokai, Master Yi, and Shaco have blinks or dashes', 'What champions have blinks?'], ['Dont forget second W activation'], ['it is a dash', 'Its a dash', 'dash can be interrupted'], ['Zeds ult'], ['It counts'], ['the state of the game is pretty much people posting on reddit instead of being self-dependant and googling', 'Google is killing conversations', 'discussion was welcome'], ['Only the reactivation of her w is a blink'], ['She will take famagw'], ['others could learn too'], ['people post on reddit when they could be self-dependant and google'], ['you can cast during travel'], ['Just getting rid of dead air'], ['Leblanc is not present']]"
reddit,67,Voluntary Evacuation Beginning at 6pm for Toms River Barrier Island and Low-Lying Area Residents.   ***TOMS RIVER BARRIER ISLAND AND LOW-LYING AREA RESIDENTS: VOLUNTARY EVACUATION BEGINNING AT 6 P.M. TODAY***,"[['You should move your car to higher ground if possible', 'we just missed flooding in December', 'You are kind of stuck parking your car in your yard to get it off the street', 'You should get stuff together to leave if you have to', 'Water came over the bulkhead and completely surrounded the house', 'No cars are allowed to be parked on the streets', 'There will most likely be tidal flooding with the storm tonight in to tomorrow morning', 'Water poured out the end of the lagoon into the streets', ""Is there any part of your yard that didn't flood during Sandy or the December storms?"", 'The biggest issue with moving the car is how do we then get back home'], ['Brick put out an evacuation notice to those living on the barrier island yesterday'], ['I have a bad feeling about this storm', 'I am a little bit worried', 'I just worry for those who do live in those areas']]"
reddit,68,"That Pre-order Blues   *Sigh* Late Shipping before it was released in stores. This was ordered all the way back in December. I do have a tracking number! (Yay!) and it seems to work!      Here is the thing, it said it has been in HK's mail terminal for the last 2 weeks!      How long does it normally take for this thing to come in?!","[[""I have no idea when I'll get mine"", 'I am a preorderer who has nothing', ""many kickstarter backers and early pre-orders still haven't gotten theirs""], ['You only got the one email OUYA cared about', ""The really disappointing thing is I haven't gotten so much as an update"", 'I just wish they kept us in the loop'], ['HK### tracking number is useless', 'What a complete disappointment', 'It works on zero sites I have been advised to try'], ['most say it takes about 10 working days for shipping from HK to Germany'], ['it would be safe to spam them with cancellation requests and just go grab one at retail in a store']]"
reddit,69,Thought up a fun new game.  Apartment complex or baptist church?   Basically you just try to guess if the random words are the name of a Baptist church or an apartment complex.  Some examples from my neck of the woods:      * Stonegate   * Wildflower   * Trinity Place   * Crestview   * Thornwood      It gets pretty hard.      Answers:      * Church   * Apt   * Apt   * Church   * Apartment,"[['Apartment is preferable', 'Apartment', 'Trinity Place is an apartment', 'Wildflower is an apartment'], ['Church is preferable'], ['Church', 'Stonegate is a church'], ['Crestview is an apartment'], ['A lot of them would be named for where they are regardless of what they are', 'It gets pretty hard'], ['Thornwood is a church']]"
reddit,70,"Polymer coated wad cutters?   After seeing this post http://imgur.com/deVGgYF I began to wonder if anyone out there has poly coated wad cutters.      I only see semi wadcutters, looking for the full Monty.","[[""there's no reason you couldn't powdercoat Wadcutters"", ""I've had excellent results with powdercoating bullets"", 'Sns Casting has coated wadcutters'], ['Xtreme is great'], ['Jacketed or plated are a different class all together', 'You can get copper plated WC'], ['I use the same reloading data for 138 grain bullets'], [""What's the difference between powdercoating and polymer coating?""], ['I will probably be looking to switch to coated bullets when I re-up on wadcutters'], ['Polymer coating like Eggleston Munitions and Palmetto offer are talked about profusely']]"
reddit,71,"How's this look for a MB/CPU combo?   CPU: Core i5-6500 3.2GHz LGA 1151 Boxed Processor     https://pcpartpicker.com/part/intel-cpu-bx80662i56500      MB: ASUS Z170-AR LGA 1151 ATX Intel Motherboard   https://pcpartpicker.com/part/asus-motherboard-z170ar         EDIT:  Micro Center cancelled my order, because the MB is no longer available, so I've swapped it for this one:    http://www.newegg.com/Product/Product.aspx?Item=N82E16813130884                  I've built a few PCs in the past, but I always get nervous about compatibility issues.  I'm trying to build a budget-oriented, VR-ready PC.  I've got both of these parts for $296 through Micro Center.  I plan on going with the GTX 970 GPU, that I'll buy later.  Other than that, I already have the case, the PSU (Corsair CX750) and the RAM.","[[""I have an Asus mobo (Maximus VIII Formula) and it's rock solid""], ['Those are cheap'], ['You will likely be able to get away with using usb3 ports on your case', 'You may need a USB bracket to expose more USB 3.0 ports at some point'], ['the 6600k is the answer', 'You should check out the 6500K version for a processor that can be overclocked'], ['there are a total of five USB ports on the back'], ['waiting for more info on Polaris may be best', 'wait on buying a cpu'], [""it's worth checking out the 1070"", 'You should check out the GTX1070 as the go to budget card'], ['That is not a bad motherboard', 'That is a good choice'], ['You can ignore the ASMedia ones as far as the Rift is concerned'], ['You should wait a couple weeks for the price of the GTX970 to drop']]"
reddit,72,"[NG][135][Chalice Dungeons][Skaloola]   Up for any chalice dungeons.  I'm on 2nd boss on the Lower P.  Also even though I'm still in NG I've coop'd most every boss in NG+ now, so if you need help also feel free to hit me up","[['removed the password', 'the password is the same', 'no pass is set'], ['I have to start at layer 1', 'I would have to backtrack to the first floor lampost for you'], [""I'll be able to help with your defiled dungeon""], [""Joining v38v6td4 on Layer Two, going inside and ringing the bell at the lamp with 'RedditHB' as the pass""], [""The easiest thing to do would be to get to layer 4 on your own in v38v6td4 and then I'll summon you""], ['Dropping my covenant'], ['I am actually clearing trash'], ['I am at the layer 3 lightpost right now'], ['I can still join'], ['I dont have a mic'], ['I will be afk summoning until about 9:40 - 9:45 (20 min from now)'], ['I will go on the Lower pthumeru one'], ['Need to clean up a bit'], ['You have the defiled pthumeru chalice'], ['it should work']]"
reddit,73,"Help needed with template installation   I got a new template which is bit huge as compared to my connection speed (15mb). When I tried the normal way,  couldnt use the upload and install it. Since its doing nothing (time out).      Is there any way that I could manually upload via FTP and install the template?","[[""15MB for a template doesn't make sense"", ""15MB is the 'quickstart' package""], ['That actually sounds really likely'], [""You should use RocketTheme's Gantry"", 'There are several free as in beer Gantry powered templates at Rocket Theme', 'Gantry is a framework', 'Gantry is very flexible', 'The template is a starting point for developing your own theme / template using the Gantry Framework'], ['Unable to find install package'], ['You uploaded the zip file', 'Upload the file', 'please delete this monstrosity', 'You have to leave the package zipped'], ['fire your template developer'], ['zetufu2u is correct'], [""I got the following error: 'Please enter a package directory'""], [""I like RocketTheme's Gantry so far""], [""Use the 'Install from Directory' option""], ['Gantry has the cost of divitis'], ['I am partial to Quasar'], ['never mention it again']]"
reddit,74,"Clawhammer Progress   I'm learning clawhammer as a side hobby, and I've been progressing very well. However, I've hit a wall. I have absolutely zero problem playing hammer-ons, pull-offs, fooling around and freestyling, if you will, within the context of the bum-ditty. But I can't play songs!      1. I can't play quarter note rolls      2. I can't integrate the melody into the rhythm      This song is a perfect example ([I'll fly away](https://www.youtube.com/watch?v=Pp8xJVlQLiM)). Extremely basic melody - no problem there. But I can't put the melody into the bum-ditty! I don't understand how they sync up and it is extraordinarily frustrating.       I lose it at exactly 2:19. It goes from extremely basic non-music to mind bogglingly confusing. Any help will be greatly appreciated!","[['You should start with the rhythm', 'I had already a pretty good ability to understand complex note patterns and such from piano while keep time', 'This simple explanation is so helpful', 'In some spots in this song, you play a few melody notes without bum dittying', 'Banjo has this magical third dimension, where the melody IS the rhythm.', 'You can just hit a few melody notes and then jump back into the entire bum ditty', 'banjo is first a rhythm instrument', 'Strip it down, play the melody, and only add in the extra notes when needed', 'Focus on playing the melodies first', ""You can 'rest' for the bum and then just ditty"", 'The idea of melody first, rhythm and additions later probably starts from a piano background', ""The ditty is going to be the 'strum/thumb'"", 'It is far easier for me to keep up playing if it sounded more and more like the song', 'It takes a while playing to get to that point.', ""You don't need to keep pounding on the bum ditty if it doesn't fit the song"", ""I end up 'uneven' on the bum ditty"", 'the notes are supporting the rhythm not the other way around', ""You suggest stripping out all the 'fluff' - just get the shell of the melody rather than try to force it into an arbitrary rhythmic pattern."", 'Clawhammer does have a rhythm portion', 'the idea is that it should be enjoyable', 'This is actually a really good song to practice this stuff', ""Get the feel of actually *playing* the tune - it doesn't matter if you start with some rhythmic pattern and slowly add melody, or start with melody and add rhythm later."", 'I was frustrated when I started learning through rhythm only how few songs sounded like songs', 'It is the same advice, just from different directions', ""It usually happens when I feel I need to strike another melody note before the next two ('dit-ty') beats"", ""You're not doing rolls, but playing a song with notes in order"", ""if I were learning this, I'd find a sample or teacher that started with a super-simple rhythm"", ""on the banjo the actual notes don't matter so much"", ""It's okay to have full quarter notes, skip the ditty and just hold for the melody""], ['I really find playing from tab to be the best way to learn a song', ""There are tons of great beginning songs on mike inverson's clawhammer tab website"", 'This is where good tab helps'], ['on the fiddle the actual notes matter'], ['The bum is going to be your melody note'], ['I enjoy teaching myself banjo']]"
reddit,75,Open Mic night questions   If anyone has any experience running open Mic nights I'd really love to hear any tips you've learned along the way.,"[['Keep your gains low', ""Have some vocal mics dialed in, a couple DI's and a couple 'oh crap' mics standing by"", ""It'll sound fine that way"", ""Two DIs and two 57s to care of any 'OH shit' moments"", ""Overall volume shouldn't be too loud"", '2 mics on boom stands and 2 1/4"" into DIs will be enough', 'Two or three vocal mics set up and ready to go', 'You should have a couple of DIs and a couple of mics, and have back ups of both', ""3rd of each will be enough if you're expecting a lot of people"", 'You should set your levels low'], ['I just swap out cymbals', ""Most drummers use my kit that's already set up""], ['Compression can really be your friend in the case of open mic'], ['Reverb set to stun', 'I am going to use REVERB Set to Stun as my flair'], ['I hate a complete drum load in', 'If a drummer shows up, kick and overhead', 'drummers should just not'], ['I have a tea cloth on the snare'], ['hand drums are OK'], [""Always push the vocals out front if they're talented""], [""Two wedges if you have 'em but they can be just one Mix""], ['Amp stands help the players better realize the actual level and tone of their instrument'], ['Consider buying amp stands online'], [""It's all about context""], ['We always encouraged newcomers and first-time performers'], [""If there were young kids getting up there for the first time, their parents were usually in the crowd buying tons of drinks so there's a bit of playing to the audience""], ['Clubs are usually pissed if it becomes a serious amateur hour and the bar crowd starts leaving'], ['Be smart, and try to make everyone happy']]"
reddit,76,"[Build Help] Mobo is a mofo.   I already have a monitor/hdd/kb/mouse and I can pick up/get an optical drive anytime. I'm looking to do a moderate amount of gaming (Basically Portal 2/Half-Life as well as emulators) along with photo editing. I have no problem upgrading further down the line, just looking for something capable for the time being.   Trickest part for me to grasp at the moment is what to look for in a mobo. Everything else makes some sense due to years of playing with basic pc's, but I've never dealt with buying a mobo/processor.   Thanks for looking!       [Part list permalink](http://pcpartpicker.com/p/3zcf) / [Part price breakdown by merchant](http://pcpartpicker.com/p/3zcf/by_merchant)      Type|Item|Price   :----|:----|:----   **CPU** | [Intel Core i3-2100 3.1GHz Dual-Core Processor](http://pcpartpicker.com/part/intel-cpu-bx80623i32100) | $99.99 @ Microcenter    **Motherboard** | [Gigabyte GA-P67A-UD3-B3 ATX  LGA1155 Motherboard](http://pcpartpicker.com/part/gigabyte-motherboard-gap67aud3b3) | $162.05 @ Amazon    **Memory** | [Kingston 4GB (1 x 4GB) DDR3-1333 Memory](http://pcpartpicker.com/part/kingston-memory-kvr1333d3n94g) | $19.99 @ NCIX US    **Video Card** | [Sapphire Radeon HD 6870 1GB Video Card](http://pcpartpicker.com/part/sapphire-video-card-1003143l) | $152.55 @ Newegg    **Case** | [Thermaltake VM600M1W2Z ATX Mid Tower Case](http://pcpartpicker.com/part/thermaltake-case-vm600m1w2z) | $37.99 @ Microcenter    **Power Supply** | [Cooler Master 550W ATX12V Power Supply](http://pcpartpicker.com/part/cooler-master-power-supply-rs550pcare3us) | $50.99 @ SuperBiiz     | | **Total**    | Prices include shipping and discounts when available. | $523.56    | Generated 2012-01-07 23:43 EST-0500 |","[[""I don't need anything too special"", 'The mobo is fine for what you want'], [""I wouldn't recommend Cooler Master's eXtreme series PSU""], ['Without an unlocked CPU, there is no reason to spend so much on a motherboard', 'You can also look at an ASRock Z68 Extreme3 Gen3', ""I'd take a look at the MSI P67A-GD65, MSI P67A-GD80, ASRock P67 Extreme4 Gen3, or Gigabyte GA-P67A-UD4-B3 instead""], ['You should get a better quality 2x2GB kit', ""I don't know one person who runs DDR3 in single channel"", 'You can buy another 2x2GB kit of the same make and model and have 8GB in the future', 'Dual channel RAM will just be faster', ""Your memory won't work"", 'Thank you for pointing out the issue of 1 vs 2 dimm', '8GB will come in handy with photo editing'], ['You can get a 650w Corsair for all of $6 more'], ['Every modern mobo will run with a single stick of RAM', 'His motherboard does NOT need dual channel to work', 'You can run with one stick just fine'], ['Lots of people would not notice the difference'], ['The memory was pretty much a placeholder for me']]"
reddit,77,"WTF is up with Mental Might?   I just started playing, about a week ago. The first few days I played against all of the theme decks. Maybe more of the BW:Blue and BW:Green deck, but a good mix of everything. The last three days have been Mental Might or a modified version of it. It's cool if I can get ahead before they have 1-2 super saiyan Gallades, but it requires some luck. It's getting really annoying only playing against one deck. Did someone win a tournament with it? What's up!?!?!?      /saltyrage","[[""Actual theme deck tournaments (in real life) don't exist""], [""You might want to try Standard if you're getting tired of playing against the same deck in Theme mode"", ""I'm getting EXTREMELY tired of playing against Mental Might"", ""For the last 3 days, I've played almost exclusively against Mental Might"", ""I'm getting very salty at only playing against it"", 'I have played ~60 games, almost exclusively, against [the deck] in three days', 'I would like to play against some of the other decks'], ['There is potentially an influx of new players or people getting tired of running the same Basic Blue/Basic Green all the time', 'It would get to a point where so many people were playing red, people would start playing blue', ""Mental Might is the only deck you can use as a new player if you hadn't unlocked the basic green, blue and red from the trainer challenge to use for versus"", 'If everybody started playing Basic Green (almost exclusively) people would realize and switch to basic red'], ['It could also be somewhat as a counter to common decks'], ['Mental Might is one of the best theme decks', 'Mental might is a good deck'], ['Save up some packs and trade for a deck you think looks interesting'], [""The only things that are of concern in Mental Might are the 2 Gallades and the Miltanks if they're around""], ['Mental Might is a very safe and predictable deck to play against for me'], [""There's no reason it's been all I've faced for three days""], ['All of the XY Basics should be good against Mental Might'], ['Maybe others have had similar daily challenges pop up']]"
