subset,id,questionText,clusters
reddit,0,"What should I draw next?   A FB user said they wanted to see a Zapdos, but depending on what people say on here, if any, I may do one that you all choose! So help out if you want!            Or don't. :)","[['I would like to see any of the Legendary Beasts, Raikou, Suicune, Entei', 'If I do not choose Suicune now, I will definitely choose Suicune very soon', 'I will consider Suicune for sure'], ['I would love to see Reshiram'], ['Pancham'], ['Seel?'], ['You should girafarig'], ['I may wait on that one']]"
reddit,1,"Historical Hypocrisy   (First, a disclaimer: This is the first post on here I've ever made, so I sincerely apologize if I completely screwed up with the ""reddiquette"")      I have noticed that a lot of fat-acceptance folks use images of The Birth Of Venus, the Venus de Milo, and some other famous Boticelli painting to show how larger women are actually beautiful. However, I myself have a similar body type to the subjects of those paintings, and they would tell me I have thin privilege. Titp even posted something saying specifically that women who are a size 6/8 (my size) have it much easier than them. However, the women in these painting that they use images of are probably a size 6/8.       The link: (http://imgur.com/46pJL9U)      I just thought this seemed like a silly and somewhat hypocritical double standard.","[[""I can't repost this enough""], [""The 'idealized' woman at the time was bigger than our current 'idealized' (ie, models)"", ""The idealized image was larger than the average woman, and now it's reversed"", 'For women, the ideal has always been healthy with obvious signs of fertility (REAL curves: hips and breasts)', 'The women in the paintings from centuries ago were what we would call curvy', 'The examples they use to try to prove that fat women used to be considered beautiful usually include women who are overweight at most'], ['Postimg is horrible', ""Your view on the image hosting site chosen by /u/dmstewar2 doesn't negate their post or its validity""], [""can't link TiTP""], [""These men weren't admired and respected""], ['Hugely obese people back then were very rare and were ridiculed (just like super-skinnies now sometimes are)'], ['I visited the first link and gave up'], ['For men, health and vitality has always been the ideal']]"
reddit,2,"If 100 minions @ 10mins is the metric for ""perfect cs"" in lanes, how many cs are for junglers by 10mis to be equally ""farmed""?   Not counting tax or taking cs from your laners, those are bonus.","[[""Cowsep's greatest contribution to the game was 'tp smite yi' with '10 minute flare'""], ['30 CS every ten minutes is pretty good', ""I don't blame people to try different things"", 'you need to know when to farm and when to do other things', 'You are doing something wrong', 'it is a valid strategy like any other', 'Champions that benefit from farming more than ganking are basically the first 10mins', 'It is just such a hard metric', 'Junglers with High CS can get 50 CS at 10 mins, roughly half of laners', 'jungle routes matter', ""it's just a simple question to compare monster camps to regular creeps and no more"", ""it is very easy to see 'perfect farm' jungle play"", '50-60 Cs is good', 'cs is probably the worst metric for jungle performance', 'jungle creep score is far from a good metric for not only performance but just farm in general', '1 or 2 ganks, the rest heavy farming'], ['Playing Morgana mid is her job'], ['You picked Udyr'], ['solo q is boring as it is'], ['some people took it too far out of the topic'], [""let's downvote each other and move on""], ['xin zhao/shaco is the terror of bronzodia'], ['Almost every gank gets at least damage, summoners, or more'], ['Cowsep disagrees'], ['3CS is enough'], ['He should get blamed'], ['Almost all the players hate having him on the team']]"
reddit,3,Bike racks - what to look for?   I'm in the market for a bike rack. I've been looking at the Saris Bones 2 and 3. The only difference I can tell between the them is that the 3 series has an extra arm for stability. Is the Bones 2 not to be trusted?      Any other brands/models I should be considering?,"[['If you cannot attach bikes to a roof rack or a hitch, use the bones', 'I would recommend getting a hitch installed', 'If you can attach bikes to a roof rack or a hitch, do that', ""If you don't have a hitch, and have no interest of adding one, go with the Bones""], [""You should consider the Thelma from Saris, Thule's 916/917, or Yakima HoldUp""], [""there's no real difference between the two racks""], ['I highly suggest looking into a more permanent/secure solution', 'The bones 3 fit nicely on my station wagon', 'I use roof mounts and the bones 3 in combination now', 'The bones 3 keeps the bikes apart from one another', 'I absolutely love the bones 3', 'Swingdaddy is for when we have more than 2 bikes', 'the Bones 3 is only used when I need to carry 3 bikes (or 2 mountain bikes so they have more room since they are so bulky)', 'The saris 2 can only take two bikes securely', 'I would highly recommend Saris Bones 3', 'I prefer roof top carriers', 'I prefer the 3', ""The bones 3 doesn't mark up the car"", 'The Thule trunk offering is pretty fancy and stable as well', 'The bones 3 is the best bike rack I have ever had'], ['The stuff on your car is worth way more than the actual car'], ['They are a bit cash to own'], ['Yakima HoldUp is awesome'], ['the Bones 2 is preferable for regular use', 'You should stick with the Bones'], ['one advantage of the Saris racks is that the carrying arms are adjustable so that you can bring them closer together for smaller frame bikes'], ['A knot with the excess cord is key to keeping the bones 3 tightened', 'the side straps on the Saris are unnecessary', 'the cheap Allen one was better in some ways', 'it is hard to get the straps to stay tight on the Saris racks'], ['The bones 3 fit nicely on a sedan'], ['I usually travel to stage races with 6 bikes and 4/5 riders in the car'], ['The Saris Thelma is great'], ['Buy a Jeep'], ['For trunk racks you cannot do better than Saris'], ['You only need things like a workstand or a mountain bike once a month max']]"
reddit,4,So my first dragon encounter didn't go very well...   [I thought it was just an interactive moment](https://www.youtube.com/watch?v=h94JWwBV-J4) and that the dragon was just going to fly away so I was caught a bit off guard by what ended up happening.  It ended up being a pretty funny series of events though I thought I'd share.      What's the funniest or most badass thing that has happened in your game?,"[['You saw your team was on fire and immediately ran to join them', ""You're running into the fire yourself like 3 times"", 'I thought it was gone', 'I thought I could run through', ""I didn't know what I was doing""], [""I might've been a little intoxicated""], ['He was just trying to score karma'], ['I knew it was time to hightail it out of the valley'], ['I did get a face full of fireball when I actually tried to get a screenshot of her on the ground'], ['It one shot me from behind full dark souls style']]"
reddit,5,"A bug with the minimap, requesting help.   I was playing League of Legends a few hours ago and enemy cho'gath appeared on the minimap on top lane, and a second later, he appears on the bot lane. I've wanted to take screen shots using LoLreplay, but the minimap icon for cho'gath changes too fast from top to bot to properly take screen shots. Since there is no rewind option for LoLreplay, I decided to give up after various attempts.         I've tried to take videos but end up failing miserably for I have no experience doing so.         I have uploaded my LoLreplay file to 4shared and hope someone more skillful than me can provide me the screenshots or video of the incident (including both the timer and minimap).         The time stamp is from 18:45 to 18:52 of the replay when Alistar and Ryze (me) ganks olaf. It actually happens in the split seconds between around 18:48 to 18:49, so 18:45 to 18:52 should cover it just fine.         Please message me if you are available to help, I have decided not to post the link for the 4shared download.       tl;dr LoL have a bug with minimap where enemy jumps from top lane to bot lane. I provided the wrong intel to team claiming they're safe. Need help getting screenshots or video from LoLreplay. Will provide 4shared link for LoLreplay when you message me. Read the full text above for the time stamp of the incident.         Thank you.","[[""Eve is even harder to locate when she's roaming""], ['I am willing to make a video with LoLreplay for evident purpose so I can send in support to Riot or something'], ['My minimap bugged yesterday', 'Minimap is very misleading', 'I have had problems with this on the PBE'], [""Cho'gath doesn't have teleport""], ['eve was mid 1 sec later'], ['I was a malzahar go from mid to bot in 1 sec, without teleport'], ['Me pinging saved top'], ['You got your team killed is even worse']]"
reddit,6,"Crediting waitressing as a workout? Am I really starving?   Hey loseit,      I work on weekends part time as a waitress. I've been using MyFitnessPal to track calories and every time I put in a shift at work as a workout (it really is) it comes up as a huge calorie deficit. Would this actually be starvation? I don't feel starved, I'm usually very satisfied with how much I've eaten in a day on the weekend.      During the week I eat around 1400 calories, but on the weekends I'm 1000 calories short when I add in my waitressing. Is that okay?","[['Waitressing is a workout', 'You are completely justified in regarding waitressing as a workout', 'I estimate around 300 calories burned when I work 5-6 hours on a busy night (like Fridays, Saturdays, or holidays)', 'I always underestimate', 'there are people who can undereat significantly for weeks and not know', 'It came up to average about 7.2 miles assuming a busy restaurant with 6.5 hour shifts', 'Try using a pedometer to see how much you are actually walking', ""If you aren't really hungry, and you continue to lose weight, it's all good."", 'I am not familiar with my fitness pal', ""If it isn't a busy night, I'll put in 150-200""], [""I wouldn't put too much faith in workout calorie burning estimations.""], [""Micronutrients don't follow this same pattern of signalling""], [""Over a few months you'll get a pretty good idea of how many calories you actually burn in a given day""], [""Rather than trying to quantify waitressing in terms of 'I burn this many calories during a shift', you might try thinking of it as more of a running average over the course of a week""], [""There is not a 'waitressing' option to click on""], [""You might think of it more as, 'because I have an active job, and because in addition I work out X times per week, my typical average calorie requirements for maintenance are 2500 per day'""], ['I approximate the time I was walking and which one would fit better'], ['I do eat the restaurant food'], ['I figured as long as I am not hungry I am good'], ['I wore a pedometer for a few months when I worked and it really helped me have a realistic idea of how much I was really walking'], ['If calories are too low, they will signal hormones and other compounds in the body to increase hunger'], ['If you are undereating by 1000kcal a day, you may very well be getting those extra calories from body fat and glycogen'], ['It is more helpful to think of your activity level in a more general way'], ['Losing fat is all about averages'], ['Most people burn 100 calories an hour just standing'], ['On the weekend I barely eat'], ['People need to look out for micronutrients'], ['Saturdays are my favorite diet days'], ['Some Friday/Saturday nights, I could walk up to 8 miles'], ['The 1000kcal deficit is completely fine'], ['The better waitress you are, the less calories you are going to burn'], ['The only purpose to calculating day-to-day estimates is to help maintain those averages'], ['Tuesday nights I usually averaged around 2-3.5'], ['You do not need a calculator to tell you if you are starving'], ['You should change your diet in response to that figure, run with it for a month, and then measure your results against what you expected to see']]"
reddit,7,"Reading Chap. 510 and, we saw As Nodt steal Senbonzakura, but we also 3 more Bankais stolen. Did we ever see them used by the Stern Ritter?   Kokujo Tengen Myoo was sealed by Basterbine and Jaikou Raikouben and Daigren Hyourinmaru were also stolen. Were they used in the battle and i just missed it? Or do those individuals still have control over them now? Starting from http://www.mangastream.to/bleach-chapter-510-page-12.html","[['the girl used Kommamarus bankai before Yama died', ""The one who stole Hitsugaya's bankai was seen using it in one frame"", 'the stolen bankai were used in combat'], ['No bankai is to be seen', 'the guy who attacked Yama got his face completely melted off', 'The other Quincy attacked Yama-jii and were quickly executed before they could use them', 'The only bankai that was used after they stole the bankai was Senbonzakura', ""the bankai weren't used"", 'Yama attacked him', 'this is another guy who tried to attack Yama from behind', 'They still have them'], ['As Nodt should be alive'], ['She had her sword out'], ['nodt was the only one SHOWN burning up']]"
reddit,8,"After long time coming, I finally get to see my online portfolio site go live!   [Pharaoh](http://pharaoh.nz/).nz After working with a developer for about 4 months on and off I'm happy to see my portfolio and freelance business go live today.       The majority of the projects are branding and web design based so if that is of any interest to you guys have a look around and hopefully nothing breaks!","[[""I am in love with the 'Z' logo you did for Zachary Domes""], [""If they're underlined I may as well make them secondary links to the rest of the site"", 'My only 2 gripes are the underlines and the all centered text', 'The centered text is more of a personal issue', 'When there are ragged lines on both sides, centered text draws attention away from what is important: your great design', 'I can stomach centered text in small bits of info', 'You could try using a slight variant in color or even oblique to make it stand out rather than the underlines', 'I dislike the underlined text on the main page'], ['I like the icons for your services', 'The icons for your services could be a bit smaller'], ['The squares you have below the reel should be so that if you hover over one, it will appear above, rather than having an auto-play reel', 'You can do a much better job to represent that'], ['The underline was just the most simple way to highlight those keywords'], ['I am not at a stage where I will change anything that needs further development time', 'if the rest of the site follows suite it should end up good', 'I am pretty happy with it overall', 'Great use of the apercu font family', 'Everything looks awesome', 'I really do like it overall', 'I think you are going to do very well for yourself', 'You have an amazing portfolio', 'Apercu won out', 'I have bookmarked your site', 'The presentation is gorgeous', 'it is finished'], ['its like a window'], ['the way you display the photo-retouching is awesome', 'you can slide the original and new image back and forth'], ['By the time someone has scrolled far enough down to look at the tiles, changing the image on the slider relative to their hover would be a bit redundant'], ['Your Behance and LinkedIN links redirect to Facebook and Twitter'], [""graphic design and web/ui links in your footer don't work""], ['You should probably look into the links on the Icons (http://pharaoh.nz/graphic-design/)']]"
reddit,9,"Friend building a new house, what advice should I tell him to consider to make his AV life easier in the future   For example, I told him to wire up his house with CAT6 cable. Seems standard enough, and more useful than telephone wires.  What other things like that should I tell him to consider?  Placement of AV equipment, taking pictures of walls post-wiring, but before drywall, etc.","[['Run it all in conduit', ""Don't forget wiring for exterior like porches/garage/etc."", ""Don't forget the other wiring too"", 'Room cabling that is not staying local to their own room are ran back to the head end/rack location', 'Run all structured wiring to one place/closet (at least the CAT/Coax)', ""Don't forget to bring a CAT6 and RG6 from the outside into the closet"", 'Install conduits (and string, string is important) so he can run other cabling later', 'Cat6a (A, nothing less) is everywhere', 'Consider if you are going to have audio systems in the rooms too', 'That means inside this cable box', 'I put smurf tube in every room', 'Incoming cable/WAN connections are in central location for wireless coverage', ""You would be thankful if you needed to plug in elsewhere, and didn't have to deal with cabling strewn across the floor"", 'I would opt for smurf tube or even just string it and tie it off', 'he should spend a few extra bucks to at least wire all rooms for a whole house audio system', 'I prewired living room and media room for 5.1/7.2', '2 CAT6 drops in each room for future expansion, including VoIP phones', 'Find a closet to use as a MPOE (Minimum Point Of Entry) and bring all your cable back there', 'RG6 to each room for future TV boxes/service', 'Run conduits everywhere', 'It also turns to coax, not cat cable', ""If I build a house, I'll probably put five-six drops in each room"", 'Run CAT6 like jschmall suggests', 'Consider running Coax', ""Don't forget the volume control on the wall"", 'Also run wires for surrounds if that is relevant to him', 'Since he has the drywall off, sleeve the wall to a box so you can terminate all the cable and go from there', 'The cost of running it upfront is a helluva lot less than the hassle of running it later', 'Pre-run the speaker wire for whole home audio to each room/garage/patio'], ['Whenever you run cabling through a stud, put those nail guard things on them to avoid mishaps'], ['There are additional 20a outlets in media room', 'Run extra power into the room'], ['The builder I work for started putting GFI outlets inside the cable box on the outside of the house', ""I don't think that the cable company is going to pull fiber all the way into the house and into a closet or whatever"", ""It's not like it's just sitting outside""], ['You should not put that type of equipment on the outside of the house'], ['TV mounts cover all wall plates'], ['TV relocation kits (cat6a, power, cable pass throughs) are for bed rooms, living room, and media room'], ['They do'], ['Depending on the size of the house, consider a POE WAP'], ['You do not need them all plugged in']]"
reddit,10,"THANK YOU CANADA!!   Thank you for hosting a lovely World Cup!! No weird controversy shit, and just spot-on Canadian excellence all around.  It was great for fans to be able to hop across the border to see our ladies win the World Cup.  You folks are excellent hosts!!   Love,      Murica","[['Do we have a soccer team?'], ['I am just making a joke for anyone that live in Toronto right now'], ['The HOV needs some more crack'], ['We hosted a world cup'], ['It was an excellent game'], ['We are not sore losers'], [""You weren't paying attention to the grass vs. turf issue""]]"
reddit,11,Is Aurelion Sol coming out today?   It should be today shouldn't it? Jhin and many others were released after one week on the PBE.       (3/15),"[['Aurelion Sol will hit live servers with the new patch', 'The new patch will hit live servers after two weeks on the PBE', 'About one week after 6.6 hits', 'Aurelion Sol will come then', ""he will come with the next patch (6.6) which hasn't been announced yet"", 'He comes with 6.6 patch', 'Probably next tuesday-thursday or something like that', 'they tend to release new champions every 2 weeks', 'Next patch will probably be a week from now', 'He will be released within 3 weeks from now', '6.6 needs to hit first'], ['Only champ that was 1 week was rek sai'], ['that was like 4, 5 or even 6 years ago when they had alot of new champions frequently released'], ['the patch has been on pbe for three weeks'], ['champions have come out the week after a patch', 'the patch has been out for one week'], ['ur the one who were right']]"
reddit,12,"Are Thermalilies bugged in infinity evolved expert mode 2.3.5?   thermalilies seem to be having the same issue they had a while back where they wouldn't cool down when exposed to lava during the cooldown state, is this intentional, a bug, or am i just going crazy?  for futher information, we replaced the thermalilies with new ones from NEI, as well as the floodgates used to feed them.","[[""Use birches - they don't grow branches""], ['Endoflames are an order of magnitude laggier, easier to automate, and more powerful', 'endoflames are more powerful', 'Endoflames are far, far more scalable'], [""You don't need leaf-shearing on the harvester""], ['Any farm works for that, really, not just MFR'], ['Floodgate dispenses lava in six-minute-ish intervals'], ['Endoflames produce more power than exoflames require to smelt the coal'], ['Anything that can be controlled by redstone and deposits items in-world'], ['Put munchdews far enough to not cover the entire field (Manaseer Monocle shows the range), so there are saplings to replant the trees'], ['I really like item grates + hopper with a pressure plate to close the item grate'], ['That works even better than pure-Botania'], ['It is very easy to automate 8 thermalilies per MFR fountain'], ['if thermalilies consume lava during the cooldown period the cooldown starts over'], ['thermalilies produce more mana', 'thermalilies have a shorter cooldown time'], ['You should make a quick compact timer with ProjectRed']]"
reddit,13,"Questions about Madness and when cards can be played   Let's say that, at my discard step, I discard down to seven and get rid of a creature with a madness cost- could I play that creature before the end of my turn, or would it have to go straight into the graveyard because it's not a phase where I could play a creature?      For that matter, let's say I discard a card at instant speed, i.e. discarding it as part of the cost of an instant or the ability of a creature on my opponent's turn, and that card is a permanent without flash or a sorcery. Could I pay the madness cost and put it onto the stack, or would it just be discarded to the graveyard because it's an inappropriate time to play it?","[[""The rules are perfectly clear and answer OP's question completely""], ['The discard is part of resolution of the spell', 'You can cast the card from exile after discarding it there from your hand', ""The permission granted by madness doesn't care about what card type the card has"", 'You can play the card instead of discarding it, whenever that is', 'Madness grants express permission to play the card during the resolution of an ability', 'I cast a spell where part of the cost is to discard a card and I discard a madness card', 'You discard a card with madness to the exile zone', 'I let the spell resolve then cast the madness card', 'the card is still discarded, except into exile', 'When the trigger resolves, that is your opportunity to play the card', 'You get priority to cast madness', 'A trigger will go onto the stack when you discard a card with madness', 'In the case of discarding a madness card for hand size, you will get the trigger and an opportunity to play it during the cleanup step', 'After resolving spells or abilities, the trigger will be on top of the stack', 'The trigger has to wait for any resolving spells or abilities to finish in full', 'During the resolution of an ability is not a time you can play an instant without an express permission to do so', 'You cast the card with Madness as part of the resolution of the Madness ability', 'A madness card can be cast during your cleanup step', 'I cast the madness card when it is discarded (halfway through the spell to resolve)'], [""You can't get priority in the cleanup step""], ['Afterward there will be another cleanup step'], ['Any creature with Suspend gets cast in your upkeep'], ['If you Miracle Entreat the Angels, you get to cast it during your draw step', 'This is how Miracle, Cascade, and Suspend work'], ['This does not override, for example, Teferi, Mage of Zhalfir']]"
