subset,id,questionText,clusters
reddit,183,"Remember to exchange help and expertise among yourselves. Ask and offer help !   Installing Theano ? Running Docker on OS X ? Making LeNet converge ? Understanding gradient descent with momentum ? Understanding why linear models must be linear on the parameters, not on inputs ?      Do you need help ? Ask for it ! Can you help ? Offer it !      Each one of us has unique contributions to bring to this class.","[['My friend recommended anaconda and then to install theano and keras', 'I got this message: unable to import gof', 'You need to download and install the CUDA drivers', 'Does anyone have previous experience on how to properly set up the use of GPU on Linux for parallelism programming', ""You probably won't be able to use CUDA"", 'You should try to test the CUDA installation before installing Theano or Torch7', 'I can also help with the installation and use of Theano, Lasagne, Chainer and Torch7', 'I also know how to train from an existing model', ""If you're using a notebook this won't matter anyways"", 'Running theano on windows is a freaking nightmare', 'I support the idea of installing Ubuntu in a virtual machine', 'vocs podem facilmente instalar os frameworks com apenas um comando de linha aps ter instalado o Docker', ""You won't be able to use CUDA/GPU in this case"", 'It was even worse to look at the internet about this', 'My suggestion would be to install VirtualBox and run a linux virtual machine', 'I got stuck in Theano', 'You should try to follow the steps closely', 'I am having some problems on how to use the CUDA/GPU on Linux (ubuntu 14.04)', 'In Linux, installing things is a bliss', 's tem theano para ubuntu', 'I will try another thing tonight', 'When you installed theano, it found correctly the path of python', 'The Nvidia website is generally helpful', '""import gof"" seems to be a problem of linking to python', 'I would like to exchange ideas on how to do it on Caffe', 'Because of anaconda, the path to the lib changes', ""You must make sure your GPU is compatible with the CUDA version you're installing"", ""One way to do this is by typing 'nvidia-smi' on the command line""], ['If anyone needs one of the recommended books, please come talk to me in person'], ['Now even Statistical Rethinking is within my grasp'], ['Please post your questions on this subreddit'], ['some of you could show me how to run a linux virtual machine'], ['I can offer help with installing Caffe, OpenCV and other computer vision related libs if you are not using Docker, if necessary'], [""I don't have all dependencies figured out""], [""Talk to me if you're interested""], ['I can try to teach in-between or after classes some basic Bayesian inference and neural network topics'], ['The AlexNet paper was the first paper to actually apply a deep convolutional network to a large problem'], ['The Standford video lectures are a nice resource for the basics'], ['The explanations in the Backprop paper seem to be very textbook-like'], ['The state of the art in ImageNet classification paper is kind of hard to keep up with'], ['There is a useful script to install']]"
reddit,184,"Another pick your own RDA, RBA / Tank Giveaway!   ### Choose 1 RDA or RBA below  ###   [Ecig Avenue](http://www.ecigavenue.com) Is giving away another RDA MOD or RBA MOD of your choice this week.      Just comment the one you want and we will announce a winner this Friday.  Feel free to give us some love.      * [Fogger v4](http://www.ecigavenue.com/shop/fogger-v4-rebuildable-atomizer-tank-complete-kit/)   * [Aspire Nautilus](http://www.ecigavenue.com/shop/aspire-nautilus-tank-clearomizer-with-adjustable-airflow-tank-system/)   * [Ithaka Clone Atomizer](http://www.ecigavenue.com/shop/ithaka-clone-replica-adjustable-rebuildable-atomizer/) ( we have one for the giveaway but not in stock )   * [Kanger Protank 2](http://www.ecigavenue.com/shop/kanger-protank-ii/)   * [Kanger Protank 3](http://www.ecigavenue.com/shop/kanger-protank-3/)   * [Kraken Clone](http://www.ecigavenue.com/shop/the-kraken-replica-rebuildable-atomizer-kit/)   * [Kanger Aerotank](http://www.ecigavenue.com/shop/kanger-aerotank-with-airflow-control/)   * [Kanger Aerotank Mega](http://www.ecigavenue.com/shop/kanger-aerotank-mega/)   * [iClear 30](http://www.ecigavenue.com/shop/innokin-iclear-30-dual-coil-clearomizer/)   * [TOBH Atty RDA](http://www.ecigavenue.com/shop/atty-clone-rda-rebuildable-dripping-atomizer/)   * [Black Nimbus RDA](http://www.ecigavenue.com/shop/black-nimbus-clone-rda-rebuildable-dripping-atomizer/)   * [Omega RDA](http://www.ecigavenue.com/shop/omega-clone-rda-rebuildable-dripping-atomizer/)   * [SM20 RDA](http://www.ecigavenue.com/shop/sm20-detachable-dripping-atomizer-kecig-k100/)   * [Patriot RDA](http://www.ecigavenue.com/shop/the-patriot-clone-rda-rebuildable-drip-tip-atomizer/)   * [Trident RDA](http://www.ecigavenue.com/shop/trident-clone-drip-tip-rda-rebuildable-dripping-atomizer/)            *Coupon code: Reddit14 for 15% off your entire order. *      *note:  Please be patient if you won a previous giveaway.  We will get it to you, don't worry.  Sometimes it takes us a bit to get it fully processed and shipped out.*         ### UPGRADE YOUR VAPE GIVEAWAY ###      *Note: This is not a reddit giveaway   We have a photo contest going on our [Facebook Page](http://www.facebook.com/buyecigs)      ### WINNER ###   /u/Tackleberryy","[['I would love the TOBH atty', 'TOBH Atty for me', 'TOBH Atty', 'Always could use another TOBH', 'I think I will go with TOBH', 'TOBH looks nice', 'TOBH sounds good', 'A TOBH would be nice', 'I would like to try TOBH Atty', 'Ithaka Clone Atomizer, thanks for the chance.', 'I could use a TOBH'], ['Fogger me up'], ['I would love a Nautilus to play with', 'I love to try the nautilus', 'I would love the nautilus', 'I have always wanted an Aspire Nautilus'], ['Patriot RDA sounds cool', 'I would love to try a patriot', 'I would love to try the Patriot RDA'], ['The Kraken Clone would be purdy on my King', 'Kraken clone please!', 'Kraken please'], ['Kanger Aerotank Mega'], ['Thanks for another giveaway'], ['You are an awesome part of this community'], ['Kanger Aerotank please'], ['the black nimbus is the best'], ['I want the sm20']]"
reddit,185,"24/F/Aus for penpals/email- Need to practice Spanish.   English works too :) just need some form of communication because I'm bored.      Here's a bit about me: I watch a lot of TV. Unfortunately I can't think of anything else to put on here and that makes me really sad (not really, I regret nothing).","[['Buena suerte'], ['Google me corrige los acentos por medio de Chrome'], ['Quiero practicar con alguien definitivamente', 'Estoy mas que disponible para ayudar a aprender a hablar en espaol', 'I can help you improve your Spanish', 'I also need to improve Spanish', 'I can help you practice Spanish', 'Puedo ayudarlos a ambos, tanto reduccin de acento, como escrito'], ['No escribo el espaol muy bien que digamos'], ['Puedo hablar en persona fcilmente'], ['Te he dejado un mensaje personal si todavia quieres hablar'], ['I could use a little help to improve my English']]"
reddit,186,"Today I've faced a Face Mage... and I lose. Bye Hearthstone it was a pleasure.   Wolfriders, Arcane Golems, Fireballs, Frostbolts, Ice Blocks, Kobold Geomancers, Forgotten Torchs...      I even played Sir Finley into Armor Up... Feelsbadman","[['I got to rank 6 last season with this deck minus the kobolds'], ['it works in the way that you can have an extra turn to burst the opponent down', 'those kind of decks are so unfun to play against', 'I was always under pressure every single turn trying to get board control (doing some favorable trades)', 'You get cheesed sometimes', 'that kind of deck are bad for ladder', 'A face mage with ice block', 'that burst of damage was out of control', 'face decks can be a real pain to play vs'], ['The process does not sound very efficient'], ['you wont be Mist']]"
reddit,187,"How many of you would play a 1v1 designed map ?   With objectives,buffs and everything balanced towards a 1v1 fight  ?","[[""I can't find a way to include supports"", 'Some of these champions that you said are pretty bad at taking objectives', ""Most supports wouldn't be highly picked"", 'It is only gonna be Kat, Nid, Ahri and maybe Galio for the sikk kounterz'], ['I would love to see Magma Chamber with Ranked system involved', 'You mean just like the magma chamber', 'He means something more like the Magma Chamber', 'You mean something like the Magma Chamber', 'The Magma Chamber is designed for that very reason'], ['any type of champion would be able to compete in a 1v1 on a map'], [""the number of shitpiles spouting '1v1 me after' when they get stomped in lane would go through the damn roof""], ['I would be so glad if game designers design a map where people can go 1 vs 1 with the rules of first tower/100 cs or first blood, with still the possibility to back'], ['Anything else would be extremely stupid'], ['Some kind of map with lava around, still some bushes for outplay and no nexus would be interesting']]"
reddit,188,"Is the appleTV CNNgo app ridiculously glitchy for anybody else?   Half the time I try to watch the news on my AppleTV the CNNgo app won't let me watch live news. Instead when I click ""watch live news"" it goes black for a second then immediately returns to the main screen. Additionally, sometimes it will turn black and just stay black. Restarting the appleTV and killing the CNNgo app do not solve the issue. It just takes time because tomorrow it'll probably work fine again.","[[""You can say 'Launch CNN Go'""], [""It doesn't automatically start playing live TV""], ['I am unable to watch their on demand content', 'Watch cnngo does not seem to work'], ['I deleted the app and reinstalled', 'Deleting and re-installing always fixes the issue for me'], ['Even their iOS app has been glitchy'], ['I have to sign back in with your cable provider each time'], ['I can watch CNNgo live tv with no issues'], ['I never did get the live stream of CNN working'], ['Hopefully they will enable watch live TV like ESPN'], ['This feature is awesome']]"
reddit,189,Doesn't Tahm Kench needs some serious number nerf?   Yeah I know we have to learn to play around it etc. etc.      But is it normal to have a guy that can do up to 38% (+2%/100AP) target max health as magic damage      while it also completely remove you from the game for 3sec      And that on a 6s cooldown with max CDR?,"[['His E is annoying', ""He doesn't need a nerf"", 'It is a lot less powerful than it sounds', ""It isn't very difficult to apply 3 passive stacks on an enemy"", ""Once he gets his stacks you're in a really rough spot"", 'if he manage to stack 3 passives without your team killing him, you and your team are doing something wrong or are in a very very bad spot', 'T K will easily be able to apply those 3 stacks without the team being able to do something', 'His grey health/shield is the only nerf needed', 'if he manage to stack the passive without the TEAM killing him, there are only 2 chances', '1 strong ability wont make Tahm kench op', 'TK top with spirit visage and frozen heart is scary', 'He is tanky as hell with his E', 'he build tank', 'His top version is scary', 'His E is not nerf worthy', 'All you have to do is focus on keeping him away'], [""Those extra % are Tahm's bonus hp""], ['His W'], ['I find playing most of the supports fun'], ['I manage to get a double kill on accident sometimes'], ['Tahm kench probably wont get nerfed'], ['Those 6% extra damage are only applied at rank 3 of the ultimate', 'There is a +6% increase from passive ultimate level up'], ['he has a modified Kalista ult on a short cooldown'], ['he is fun as hell as jungle'], ['rito will nerf him pretty soon', 'the fish needs more nerfs'], ['A nerf will come to the new champion']]"
reddit,190,Which Dharma Station/Hatch is your favorite?,"[[""The chamber's use was never explained""], [""He puts a rabbit in and says that it'll seem to disappear, but it's being moved forward in time"", ""They built 'The Vault' next to 'a pocket of negatively charged exotic matter' so that they can experiment with time and space""], ['The Looking Glass'], ['The orchid was probably the object in question'], ['Room 23 is my least favorite place'], ['The swan is my favorite place', 'The Swan is my favorite'], ['What verde did was done on a larger scale'], ['My main goal in life right now is to get rich']]"
reddit,191,"How secure is software like DD-WRT and Tomato for routers?   I have an Asus router with a closed source firmware on it.  I really like the idea of having something open on it, like DD-WRT or Tomato, since the code can be vetted to make sure there are no backdoors.      But even though the code can be peer reviewed, has either of these router firmwares been security audited by anyone?      And the last question.  Even if the router OS had been fully audited an vetted, what is the chance that an exploit might exist at the hardware level?","[[""Looking at a bunch of source code, and then running a binary that someone gives you having told you it was compiled/assembled from the source code, isn't exactly careful"", ""looking at a bunch of source code, and then running a binary that someone gives you having told you it was compiled/assembled from the source code, isn't exactly careful"", 'Building from the reviewed source does not happen nearly as often as it ought to', ""If you're going to take 'open source' seriously, you need to build the binary/executable image from the source that's been audited/reviewed"", 'building from the reviewed source does not happen nearly as often as it ought to'], [""No one has publicly stated that they've audited/reviewed the source and that it's free of exploits/bugs/backdoors""], [""Saying 'I don't want to use Tomato/DDWRT because it hasn't been formally audited' doesn't make sense""], [""wireless won't work on the ASUS RT-AC87U with OpenWRT""], ['OpenWRT is a bit trickier to get going', 'OpenWRT is still achievable for an amateur', 'OpenWRT trades user friendliness for more customisability'], ['OpenWRT trades user friendliness for much better hardware compatibility'], ['Qualified people get paid a lot of money to audit/review source code', 'There is really no upside (but a lot of risk) if someone audits/reviews source code for free'], ['The potential for better security exists', 'I would go with open-source firmware for a consumer level router'], ['flashing my router daily could get old quickly'], ['wireless not working is a big deal breaker'], ['DD-WRT does have a functional beta for the ASUS RT-AC87U'], ['I am hoping a stable dd-wrt comes out for my router soon'], ['I am a little wary'], ['OpenWRT only gets distributed as source']]"
reddit,192,"Pearl Jam Playlist discussion   I'm sure I'm not the only music fan who's interested in alternate track lists and new ways of experiencing music and other media. Sometimes, if you mix up a band's tracks, you can get a whole new experience.     A Pearl Jam example: [the original *Binaural* track listing](http://en.wikipedia.org/wiki/Binaural_\(album\)#Original_track_listing) is a whole differnet album, imo.     So, fans, I ask:      **What's a great Pearl Jam playlist?     What are some PJ songs that make a great segue from one to the other?     What otherwise unrelated PJ songs mean something new when you put them together?**","[[""The 'Man' trilogy consists of Better Man, Nothingman, and Leather Man""], ['I am so sick of the mamasan trilogy'], ['I do have other playlists namely: PJ_Singles, PJ_Slow, PJ_Fast and PJ_infinite'], [""Habit was written about Mike's addiction to heroin""], ['I like the Better Man/Nothingman/Leather Man trilogy'], ['You could possibly throw in Habit to make it a trilogy', 'pairing is a good suggestion', 'I like these combos: Why Go, All Night, Corduroy; Thumbing My Way, Sleight of Hand, Footsteps; Hail Hail, Push Me Pull Me, Even Flow; Comatose, Leash, Blood'], ['I listen to this combo at least once a month if not more'], ['I may mock live setlists from my bootlegs'], ['I rarely ever listen to album tracks anymore'], ['My favorite trilogy is You Are, U, Who You Are'], ['PJ_NC_Y_ is my ultimate PJ playlist'], ['Save You/Life Wasted go together'], ['The Mamasan trilogy consists of Once, Alive, and Footsteps'], ['Habit and Severed Hand go together'], ['Save You/Life Wasted had no one specific in mind'], ['I have a sick one stored away somewhere']]"
reddit,193,"Broken interior door handles.   Anyone with an older C class have any problems with the interior door handles breaking off? My wife, who is tiny, grabbed the interior handle to close the door and it snapped off in her hand. She feels really bad about it. I am hoping this is not an isolated case.","[['Very common problem occurs on c classes', ""these aren't designed to be yanked and pull the entire weight of the door"", 'My handle snapped out on one end', 'It is a pretty common problem with the 2004 C240 on both front doors', 'This will make my wife feel better'], ['I put some gorilla glue on it and carefully put it back in place', ""It's fine now""], ['The door cards are made from pressed wood/paper'], ['The door cards soften up over time'], ['The fastener may have pulled through the door card'], ['You simply grab onto the handle underneath the latch in order to pull the door closed'], ['Getting the panel off the door was the toughest part'], ['the part(s) should be about $40 shipped each', ""you can just eBay 'w203 door handle' and the part(s) should pop up"", 'The handles are relatively cheap']]"
reddit,194,"Requesting YouTube tutorials   Hi everyone,      I would love some YouTube tutorials to feature in the Flex 2 info tab. I plan on making some myself, but I thought I'd ask the community to pitch in also. Let me know if you make a Flex 2 tutorial and I'll be sure to link it from inside Flex so everyone can see it.      cheers,      John Coates","[[""I will be adding smart crash reporting, hopefully in the next beta, to help diagnose errors like this that I can't reproduce""], ['You have been busy making some awesome patches lately', 'I appreciate you taking the time to share the patches with everyone'], ['I can do a voiceover', 'I could create a lot if needed', 'I can do one for you'], ['I found the buf (Processsing UIKit crashes Flex)'], ['I will tweet when smart crash reporting is out'], [""it will be very hard to follow for someone who's never used Flex before""], ['I will render the video again'], ['It would be possible to put the text from the annotations directly into the video', 'It is supposed to have annotations on the right empty side'], ['This tutorial is perfect when viewed on a computer'], ['YouTube is still processing that update'], ['I will try to get on the live stream soon to code up smart crash reporting']]"
reddit,195,Anyone have any idea on where I can get a plain black hoodie?   I'm looking for a plain black hoodie and this shit is super impossible to find :(,"[['Red Hot Designs were located in King St. in the city back when I dealt with them', 'Red Hot Designs sold plain shirts to me back then'], ['Rivers'], ['Australian Made in Willetton', 'You could try a local clothing manufacturer'], ['You could try eBay'], [""Red Hot Designs are now in East Freo, along Canning H'way""], ['neither KMart or Target had anything that was suitable'], ['Bonds are available at coles, or myer or anywhere really'], ['Do they have them without zippers?', 'I am looking for one without a zipper'], ['I love the hoodies from Factorie'], ['Malaga markets, workwear store has lots of high visibility stuff'], ['Cotton On has surprisingly not too bad quality', 'Cotton On has em for Sub-$25', 'Cotton On in Harbour Town is going for ~$5-$20'], ['Eastbay'], ['I know where I am going tomorrow'], ['n is best'], ['there was nothing in those places']]"
reddit,196,"How this Year's Draft Could Make Us a Winner in Next Year's   I was just thinking about the 3rd rounder traded to Miami for a 3rd and 4th next year (and 6 this year, damn). I just think that it makes WAY too much sense that with adding those picks we would trade up in next year's draft. What would our pressing needs be? Well, Adrian is going to be 31 then and costing us around 18 MILLION. Plus, we did not plan ahead for this year by drafting a power/replacement running back to groom. I think that with the picks acquired, it would be a fantastic idea to use them to trade up in round 1 and get who is supposed to be the next Adrian Peterson, Leonard Fournette. What do you all think about this idea?","[['I am hoping we do not go all in on an elite RB', ""We're not going to pay AD that much"", ""It'll cost too much to trade up from 32"", 'I would rather go with jet and move to a more modern offense', 'The Vikings could take two late first-round picks or just a high first-round pick', 'With the lack of needs and the amount of picks, we could be in a very good position to trade up and get Leonard Fournette if we rate Leonard Fournette high enough on our boards', 'There are some other good RBs next year like Chubb', 'It was a great trade for us', 'this trade helps set us up great next year', ""It's the draft to look at RB"", ""next year's draft will be even deeper than this year's"", 'Great trade', ""There's plenty of top talent to pair with McKinnon"", ""No way we're getting Fournette though, it'd cost us way too much"", 'It is hard to trade back into the first', 'Leonard Fournette will probably go around the bottom half of the top 10'], [""We wait every year for Rudy to breakout but I don't see him justifying his contract and he can be cut after this year with minimal cap hit""], ['Kalil is likely gone since we chose to overpay him instead of extending', 'We use the ammo to get 3 picks in the 1st and 2nd rounds to likely draft RB, LT, and TE', 'A team should select a left tackle'], ['the rb from Oklahoma has the single game record'], ['It is more likely that Spielman will use the extra ammo to trade back into the 1st if someone he likes is still on the board']]"
reddit,197,"What are some easy games to teach during the Global Reddit Meetup?   Since my country's sub is likely to meet up at a board games cafe, what are some good games that are easy to teach and then to leave them to be while I work with another group?      Last year, we had about 10 people and they quite enjoyed Resistance, but I think that I may need to split the groups so that everyone can enjoy something.       For smaller meet ups, I've tried Ticket to Ride and 7 Wonders, with the latter crashing pretty badly because no one understood the rules and gave up after just one round.      Edit: Whoa, didn't realise the side bar links to the wiki. But I had to dig a bit to find what I [need ](http://www.reddit.com/r/boardgames/wiki/wsig/large_group)","[[""I recommend Time's Up (red color box)""], [""One problem with board game cafes is that you don't really know what they have until you go there""], [""Time's Up is probably a better way to hook up couples""], [""Time's Up seems to be a good way to get people around any social anxiety""], [""Time's Up will be up the alley of most of reddit""], [""last year's meet up had us playing Apples and Apples for nearly an hour and a half""], ['Here is a list of my favorite party games from my site'], ['I am looking at Citadels'], ['I am not very well versed with party games'], ['I would pass on King of Tokyo', 'Eliminated players just hang around doing nothing in King of Tokyo', 'That can be an issue', 'The first player to get knocked out had to wait 45 minutes for us to finish when we played 5 players at a decent pace', 'Resistance, 7 Wonders, Coup, Love Letter and King of Tokyo are the first that come to mind (depending on your target group size)', 'Throw down King of Tokyo instead'], ['Incan Gold can play up to 16'], ['Incan Gold is fun, light, and gets people talking'], ['Incan Gold plays up to 8 out of the box'], ['New things are scary'], ['People like things they played before'], ['Some people will only want to play Cards Against Humanity and nothing else'], ['Try Haggle'], ['You only have to say about 5 sentences before everyone puts a card down'], ['some people will only want to play Cards Against Humanity'], ['Anomia makes a great warm up game', 'Anomia is not good for an event like this'], ['Betrayal makes a fun game for an environment like this'], ['Cash N Guns is something you explain while you play', 'Cash N Guns is the most crowd drawing'], [""Have some small secondary filler regardless of what game you're playing if it has player elimination""], ['Set up a good drop in, drop out game for people to play inbetween turns'], ['Board game cafes generally overstock on the beginner games']]"
