subset,id,questionText,clusters
stack,49,How do I repel tree squirrels that are digging holes in my lawn?,"[['You might try the mesh until you can get other vegetation better established', 'Metal mesh is a great technique for protecting flower bulbs', 'They always go for open soil', ""Once plants are established there they don't seem to dig and bury stuff anymore"", 'Now I have a couple pieces of mesh and a mesh box that I move around to cover newly started areas', 'I use chicken wire to keep squirrels out of my garden'], ['Repellent seems to work OK to repel the squirrels', 'There is a human solution to this problem that will also nurture your lawn', ""You can make your own all natural squirrel repellent at home that won't (shouldn't) kill the grass"", 'That place is forming a depression and killing a lot of the grass', 'Moth balls worked for a while', 'Your yard will smell like a bad Italian restaurant if you use the repellent'], ['Squirrels bury nuts or whatever in my back yard all the time'], ['Squirrels leave small holes about 2 inches in diameter in the yard'], ['You need to wash it all off if you get some on your hands'], ['A dog is the best option'], ['Blood meal is a high nitrogen fertilizer'], ['Chipmunks might also be digging and making a mess'], ['Corn gluten meal prevents seed germination'], ['Fish meal (and fish emulsion), horse and poultry manure and corn gluten meal are high nitrogen fertilizers'], ['My neighborhood is saturated with squirrels'], ['Put bleach on rags and hang them round the garden fence'], ['The pepper solution seems to be working'], ['The bucket with water and sunflower seeds will make them go in and drown in the water as they cannot come out'], ['A dog can end up digging bigger holes'], ['I have used blood meal and it repels squirrels']]"
stack,50,How to stop snow from sticking to the shovel,"[['Auto detail wax would help as well', 'Ballistol gun cleaner also works in a pinch', 'Keeping the shovel outdoors can most easily prevent snow from sticking', 'Spray Rain-X on to the shovel before shoveling', 'I would really prefer not to shovel snow that gets stuck to the shovel', 'Even a quick Turtle Waxing will help', 'Keeping the shovel outdoors will not work when the temperature outside is actually above freezing', 'The best cure is to use a decent car wax in paste form', 'Even a waxed or oiled blade will stick some when the temperature is above freezing', 'Spraying the blade with ether-based engine starting fluid could help when the temperature is above freezing', 'Keeping the shovel outdoors will let the snow slide off the blade without requiring waxing, oiling, etc.', 'Heavy Duty Metal Protector works great on all types of snow shovels', 'Keep the blade cold, below freezing', 'Wax that snow shovel like a pair of skis or a snowboard', 'You can get serious and do it with actual ski wax', 'Keeping the shovel outdoors will work equally well with a plastic or metal shovel blade'], [""Don't use a shovel""], ['A great hack for this problem is to use non-stick cooking spray'], ['I want to shovel quicker and more efficiently', 'Hold at a slight angle while going down the driveway just like a big snowplow', 'If you use a different type of shovel, more like a plow, and push it like a plow, there is never an issue of snow sticking', 'The plow type shovel still allows you to throw when needed'], ['If more snow, make narrower swaths'], ['Rolling snow up like a carpet may not work for you'], ['Snow sticks to the shovel'], ['The oil sprays like the dupont spray wear off the first time I use them'], ['Apply cooking spray to the bottom of a sled to make it go faster']]"
stack,51,My boss asked me to keep an eye on a colleague and report how he performs. How should I respond?,"[['It becomes part of your responsibilities', 'You should report only on things you have the ability to subjectively evaluate', 'You should avoid providing subjective assessments unless you are widely thought to be an expert within the company.', 'Try to track performance in objective terms', 'This is an important task, and needs to be performed well', 'The boss may want to know how well the team is coalescing', 'You can be devoted, but poorly trained which prevents things from getting done', 'A manager asking this of a subordinate is incredibly irresponsible', 'You may have unique or superior skills in some area', 'Evaluating and judging another member of the team could cause tension and impair the team formation effort', 'Your boss has tasked you with an important role of evaluating and judging another member of the team', '""Empowerment"" is generally a euphemism for ""abdication of management responsibility.""', 'A general rule for objectivity when reporting on people and their activities is the avoidance of anything for which there is no useful ""unit of measure.""', 'If you are uncomfortable with the role, ask the boss why and what information they seek', 'I can report that he is able to adequately understand the technology used on the project and use/create code without my direct interaction', 'Try to get your boss to be more specific about what to look for and what the expectations are', 'Your boss should be able to observe and evaluate the new employee', ""Don't get into making a judgement on someone devotion"", 'Tell the boss that you can only provide facts; their importance and relevance are a matter for management.', 'I cannot report that he is diligent and dedicated', 'You could ask your boss to clarify what they want', 'You should be trying to help the new colleague become comfortable with the new responsibilities and integrate into the team', 'Be honest and fair', 'You could approach this from a positive perspective and help the new colleague develop a training plan to more quickly adapt to the new team and new responsibilities', ""No point is saying the person is getting all her work done when you don't know what is expected""], ['I am apprehensive if I should say to my boss that my colleague could do better at his job'], ['""Keep an eye on"" implies a type of observation associated with toddlers who might get into trouble.']]"
stack,52,"Antonym of ""suspend"" as in ""Suspend a user account""","[['""Reactivate"" is the clearest', ""You could use 'unlock' as the antonym"", ""The word we usually use is just 'activate'"", ""'IsActive' is simple and concise"", 'I would use reinstate', '""Reactivate"" is fairly obvious even without context', ""I use the verbs 'activate' and 'inactivate' for these purposes"", ""The 'IsActive' field stores the answer, which is yes for active and no for inactive in the database"", 'An administrator of a website or network may decide to suspend a user, preventing them access for a period of time'], [""The origin of 'account' comes from mainframes when you had to pay to use it and your account was the amount of money you had put in""], ['Having to use terms like suspend/unsuspend or lock/unlock can be confusing'], ['Suspend and Lift Suspension make sense to me'], ['Try looking at business accounting terms if you want more ideas'], ['""Resume"" or ""restore"" will only make sense in a context where it is clear that the account has been suspended'], ['Some may find ""reactivate"" ugly']]"
stack,53,A word for not wanting to talk much,"[['""Curt"" comes to mind', '""Brusque"" is a similar word, with similar connotations'], ['""Reticent"" has no connotation of discourtesy', 'Neither of those words is especially popular', '""Reticent"" gives the connotation that the speaker\'s shortness has more to do with the speaker\'s mood or personality, and nothing to do with you or how you\'re being treated', 'Terms like ""tight-lipped"" and ""closed-mouthed"" are often used in the context of secrets', '""reticent""', '""tight-lipped""', '""not very talkative"" might fit', 'Neither of them implies discourtesy', 'The right word choice depends as much on connotation as definition', 'Terms like ""tight-lipped"" and ""closed-mouthed"" are synonymous with ""reticent""', '""closed-mouthed""', 'Your questions are sensible enough to base a conversation on'], ['""Monosyllabic"" is often used for a person who deals in one word answers'], ['I would not shy away from using them in everyday speaking or writing'], ['Laconic is an adjective'], ['They are often used to convey a certain mild disappointment on the part of the person who desires the information'], ['Terms like ""tight-lipped"" and ""closed-mouthed"" imply that information is being withheld']]"
stack,54,"Origin of the phrase, ""There's more than one way to skin a cat.""","[['There are always several ways to do something', ""1709: 'there are more ways to Heaven than one'"", ""1839: 'There's more ways to kill a cat than one'"", ""1836: 'there are more ways of drawing a cat out of a well than by the bucket!'"", '""There is more than one way to skin a cat"" is not referencing the removal of flesh from our feline friends', ""cats were used for womens' furs"", ""1721: 'There are more ways to the Woods than one'"", ""The version 'more than one way to skin a cat' seems to have nothing directly to do with the American English term 'to skin a cat'"", 'There are more ways than one to skin a cat', 'The 1840 Money Diggers reference was also the earliest I found for this exact phrase', 'the debate on cat-skinning boiled down to whether or not it was done while the cat was still alive', 'The meaning is clear'], ['it was always quite gruesome', 'The phrase may have always been a gruesome reference'], [""1712: 'Well! more ways may be found than one, To kill a Witch that Will not drown.'""], ['The phrase may have originated somewhere'], ['there was a denial they were ever skinned alive']]"
stack,55,Are there any churches in Dune?,"[['We have also the variant Zensunni rituals of the Fremen, and these take place in ritual spaces', 'We see a general sense of lack of religious faith in the Atreides, Harkonnen, Corrino, and Richese houses', 'Many of those religions are combinations of current Earth religions', 'There are no mentions of major functioning religious organizations in the Dune series', 'The OC Bible was released with a companion piece (commentaries basically) that turned out to be more influential than the actual OC Bible', ""Many religions rejected the OC Bible and it's now more studied as a historical document and philosophical text by people of influence in the galaxy than being the basis of any particular religion"", 'The first document put out by the C.E.T. basically stated a unified declaration that they had agreed on but one thing - that no religion should have a theology that proposed that they were the one true religion to the exclusion of all others', 'The Fremen religion is limited to one planet', 'The Zensunni subgroup was historically the most commonly practiced', 'Azhar Book, which predates OCB, was developed by Bene Gesserit to gather all different faiths works into one consolidated body of work', 'The Missiona Protectiva (religious arm of the Bene Gesserit) has manipulated and planted many of these religions on strategically important worlds', 'There is the Fremen religion, centered around water and the sandworms', 'There is an official quasi-religion in the Imperium that forbids building a machine in the likeness of a human mind', ""Muad'dib's religion is based on an extension of the Zensunni religion, which is a combination of Zen Buddhism and Sunni Islam"", 'We also see the Fish Speakers - and they have actual churches', 'The MP did this to aid future Bene Gesserits in their hour of need', 'The Orange Catholic Bible looks like a book from the long forgotten past', 'Following the Butlerian Jihad, it would seem they all agreed to the civil stricture banning the making of machines in the likeness of the mind of a man', 'The Dune universe is full of religions (which, one would assume, have places of worship)', 'It also seems widely used, but not core to any faith presented', ""Azhar Book would have gotten 'bible' rank"", 'The Fremen religion incorporates several Missiona Protectiva components - Reverend Mothers and the legend of the Lisan Al-Gaib (the voice from another world) and others', 'The ban on creating thinking machines is enforced by the Emperor', 'The Buddislamic faith was a broad, high-level belief system and cultural tradition that evolved through the joining of two ancient religions of Old Earth: Zen Buddhism and Islam', 'The Bene Tleilax are a perverse form of quasi-Islamic faith', 'There are a number of major religions', 'There are two branches: Zen-sunni and Zen-shiite', 'Faiths specifically mentioned specifically include the Zensunni, the Buddislamics, the Jews, and the Christians, and the Bene Tleilax', 'Paul is well prepared to make use of religion as a tool', 'What is most common to find are Buddislamists, Islam and Zensunni (which is part of Buddislamist)', 'There is no official religious organization a la the Catholic Church attached to it', 'The OC Bible took years and years to complete and a number of the members of the C.E.T. needed to be replaced during its compilation as they died of various causes'], ['The Bene Gesserit also function as a religious order'], ['The Tleilaxu have their own belief system, which can be considered a religion'], ['There is a strong hold of Jewish people throughout the Dune universe', 'Jews are still around, keeping a low profile, but with their beliefs and practices essentially unchanged'], ['There is also a blend of Buddhism and Islam, aptly named the Buddhislamic religion'], ['The Orange Catholic Bible quotes include some books from the modern bible, some from islamic suras, and some from other sources'], ['The Orange Catholic Bible was the work of the C.E.T. (Communion of Ecumenical Translators)'], ['The Orange Catholic Bible is mentioned several times in the Dune series'], ['We can presume them to be separate from the buddislamics and Zensunni']]"
stack,56,Something against hand pain due to writing?,"[['There are triangular pen grips that can enable you to hold the pen more gently and with your hand in a more relaxed position', 'Getting a thicker grip would likely let you relax your hand some', 'Different rubber tubes slipped over pens, pencils, etc. relieve my hand pain', 'It should help to practice with the new stylus', 'I used triangular pen grips as a substitute for my Lamy Safari pens when I had to write a lot of lecture notes and take written exams', 'Easy workstation guides are easily found online', 'This lets you use more of your hand to hold the pen and apply less pressure', 'There is something that you can rest your hand on while you write that allows you to move more freely, like a mechanics creeper', ""Check your hand/wrist alignment when you're writing."", 'You should be sure your PC environment is ergonomically correct', 'The common technique is to stick the pen into some form of foam or rubber grip, or even a rubber ball', 'There may be a solution to this problem', ""There's always the neoprene half-glove that makes moving your hand easier"", ""I've found it helpful to rest my wrist on a rubber/foam coaster - it adjusts the angle of my wrist just enough to relieve some of the pressure."", 'Triangular pen grips have a much nicer grip than many pens', 'Many triangular pen grips are aimed at kids but there are bigger ones with rounded corners', 'Maybe a different sized pen would help with that'], [""It's not worth risking permanent disability by pushing yourself to draw/write for a few more hours."", 'If your hands start hurting or feeling sore, take a break.', 'Perhaps the most important thing is to listen to your body', 'Take regular breaks, and do other motions with your hands to relax your muscles', 'My hand starts hurting because of holding the pen for so long', 'There may be things like hand positions that are less stressful on your body, that would allow you to work longer before needing a break', ""If you're feeling pain, you've been doing it for too long without a break""], [""I started painting instead, which doesn't require much pressure to create a visible mark (and requires much less energy to fill a space with color).""], ['Therapists have access to many writing assistive technologies'], ['You should talk to your General Practitioner MD if you are very concerned', 'He may refer you for physical therapy'], [""You can also search for 'writing brace' to find something that's a little less obtrusive""], ['Cramps happen due to dehydration'], ['Explore other methods of calligraphy.', 'Perhaps try using a brush instead of a pen from time to time, and see if that provides an outlet for you to continue doing calligraphy without wearing your hands out as much.'], ['Soaking hands in warm water before, after, and in between periods of writing is something I have done'], ['You are holding the pen too tightly'], ['Triangular pen grips may not be suitable for what you are doing, despite being available with a range of fountain pen nibs'], ['Try drinking more water'], ['Trying to hold the pen with all fingers at once is another trick'], ['You may want to consider using a wrist brace while writing']]"
stack,57,Do “asymmetric” and “dissymmetric” have different meaning?,"[['A screw is an example of a dissymetrical object which is not asymmetrical (screws have rotational symmetry) and is chiral (right and left handed screws are non-overlapable mirror images).', '""Asymmetry"" connotes a condition that never was symmetrical and thus possesses no such shadow or memory', 'Every chiral object is dissymmetrical (asymmetrical objects are dissymetrical by definition), but not vice-versa.', 'dissymmetric is not equivalent to asymmetric', '""Dissymmetry"" is typically reserved for situations where extant symmetry is broken and thus preserves some shadow or memory of its prior symmetry', ""the word 'dissymmetry' enters the English language from chemistry"", 'Asymmetry and dissymmetry have two different meanings in chemistry.', 'Every asymmetrical object, or an object which lacks any elements of symmetry, is chiral, but not vice-versa.', ""Dissymmetrical objects lack a particular element of symmetry called an 'axis of improper rotation', but they may or may not have other elements of symmetry.""], ['Dissymmetry is the violation of symmetry', ""The term 'chiral' describes the property of not overlapping with one's mirror image."", 'An object such as a chair can be reoriented such that it is indistinguishable from its mirror image, and therefore is achiral.', 'Left and right hands are chiral because they are mirror images of each other, but however you reorient them, you will not be able to make them overlap.'], ['a- (or un-) and di- prefixes mean different things'], ['both asymmetric and dissymmetric refer to the lack of symmetry'], [""dissymmetry is less 'famous.'""], [""the chemical definition of 'dissymmetry' is definitive in some ways""], ['This is the usage in French'], ['You are wrong in the question itself.'], ['asymmetry is a lack of symmetry that implies another element for making a comparison'], ['when a territorial organization is based on dissymmetries we have to speak about the pathology of federations, meaning the failure of them'], ['Asymmetry is the lack of any symmetry'], ['Spanish centrifugal federalism has traditionally based on dissymmetries'], ['The dictionary definition does not reflect the relationship between the various technical terms.'], ['The map of England is asymmetric'], ['dissymmetry will be applied to those situations where a proportional or symmetrical situation was broken in an anomalous or faulty way'], ['A chair happens to be dissymmetrical, but is achiral.'], ['A human face is dissymetric']]"
stack,58,As we know Crabbe and Goyle Sr were both Death Eaters: What were their jobs in the magical world?,"[['Crabbe and Goyle probably worked closely with Lucius Malfoy.', ""People didn't know they were Death Eaters"", 'Crabbe and Goyle Sr were Death Eaters', 'No one knew that Crabbe and Goyle were Death Eaters.', 'There is no reference of Crabbe and Goyle having a job outside of being Death Eaters.', ""Crabbe Sr. and Goyle Sr. didn't have one"", ""It wouldn't be hard to see Crabbe and Goyle actually work for Malfoy as thugs/heavy lifters for professional jobs."", 'It is very possible that Crabbe Sr. and Goyle Sr. lived off of a family fortune, like Lucius Malfoy', ""If Crabbe and Goyle's parents worked for Lucius Malfoy, we don't know what they did"", ""We can surmise that Crabbe and Goyle's parents likely worked for the Malfoys"", ""There is no canon info about Crabbe and Goyle's parents' employment""], ['You are merely repeating the names of those who were acquitted of being Death Eaters thirteen years ago'], ['At the end of the war, Crabbe and Goyle probably did a plea bargain saying some names and stating that they were confused and just loosely associated with Voldemort.'], ['Crabbe can be presumed to have a respectable position', 'Crabbe Sr. and Goyle Sr. were listed in the Sacred 28', 'Crabbe and Goyle can be presumed not to have been below a certain social status', 'Goyle also didn’t have a ‘lower-class’ job']]"
stack,59,Tel Aviv a good base to see Israel & Palestine?,"[['You should stay in Tel-Aviv to visit Tel-Aviv and then move on', 'If you rent a car it can be doable', 'Exploring the whole country from Tel-Aviv is cumbersome', 'Haifa is a beautiful city about 60 miles north of TLV', 'Haifa is a distant third', 'it have links to all major cities and regions by rail or by road', 'I could feasibly stay in Tel Aviv and explore the whole country from there', 'Tel Aviv and Jerusalem are both good choices for you', 'Tel Aviv would be a close second', 'Jerusalem could be a slightly better choice for these reasons', 'There are no good connections from Tel Aviv to Palestinian cities in the West Bank', 'Jerusalem has a lot more historic attractions', 'You should keep one week flexible to stay in whichever place you enjoyed most', 'I recommend that you make a plan of what you want to see, and then choose several bases accordingly', 'I would pick Jerusalem', 'Choosing Tel-Aviv as a base to visit the whole country, plus parts of the West Bank does not make really sense', ""If you have 3 weeks, my suggestion is to work your way through Israel, sleeping a few nights in each region, don't just stay in Tel Aviv"", 'You should stay in Jerusalem', 'The Bahai hanging gardens are definitely worth a visit', 'Tel Aviv is the better base for visiting Israel alone', 'Most of Israel is easily accessible from the Tel Aviv area', 'If you have three weeks it probably makes sense to spend a week based in Jerusalem (to travel in the West Bank) and one week in Tel Aviv', 'If you want to travel in the West Bank Jerusalem is by far the best place to be based', 'For West Bank places this will allow you to leave early and return in the evening'], ['Tel Aviv is something like Miami'], ['As a city I personally much more enjoy Tel Aviv than Jerusalem']]"
stack,60,Word meaning annoyingly ubiquitous or pithy and annoying?,"[['""same old refrain"" seems to already have slightly negative connotations even without being explicitly described as annoying', 'Cliched is defined as a trite, stereotyped expression; a sentence or phrase, usually expressing a popular or common thought or idea, that has lost originality, ingenuity, and impact by long overuse', 'It implies the ubiquity of the phrase', ""You hate it when you go to IT and you hear the same old clichéd question: 'Have you tried restarting your machine?'"", 'I propose same old refrain', 'the annoyingness/insincerity is suggested', 'This is often referred to as a hackneyed phrase', ""You hear the same old trite question: 'Have you tried restarting your machine?'"", ""all you hear is the same old, 'Have you tried turning it off and on again?' platitude when you visit an IT department"", ""Cliched is often alternatively seen with the accent as 'Clichéd'"", 'Cliched is defined as a trite or hackneyed plot, character development, use of color, musical expression, etc. in art, literature, drama, etc.', 'Cliched is defined as anything that has become trite or commonplace through overuse', 'I am trying to think of a word that is something along the lines of annoying and ubiquitous or pithy and annoying', 'If you are looking for an adjective, consider trite'], ['You could just call it a line']]"
stack,61,Dutch oven instead of oven?,"[[""I can't use coal""], ['Countertop smart and small in size ovens are being preferred as compared to Dutch ovens', 'You can buy a counter top oven', 'It is effortless to roast chicken and to perform other meat-related activities in a toaster oven', 'A counter top/toaster oven can probably cover many of your needs', 'You can buy a normal oven', 'You can get a 110 volt rather than a 220v oven provided your electric circuit can handle it', 'I would recommend a combination toaster and convection oven', ""Dutch ovens are inexpensive but can't beat the services that any toaster countertop oven can offer you""], ['It is better to take any stovetop oven'], ['A modern-day version of the same thing is made by Coleman', 'A dutch oven over a gas kitchen would work', 'A modern-day version of the same thing would work just as well on top of a gas burner stove', 'My Aunt Morey used a stovetop oven, on top of one of the burners of her kerosene fueled stove'], ['The dutch oven still cooks from the bottom up'], ['You can make your own boiled bagels'], ['You can pan-fry them instead of baking them'], ['You may want to purchase a bread-maker'], ['A convection cooking setting on the microwave can be used to make muffins'], ['You can bake cakes, loaves of bread and cupcakes with great ease with some specific settings']]"
