subset,id,questionText,clusters
stack,0,How can I avoid rakk attacks?,"[[""If you don't shoot at some rakk flocks, they won't attack""], ['If you really want to dodge a rakk attack, try strafing to the side and jumping'], ['Nothing in Borderlands 2 should scream STEALTH', 'Borderlands 2 should scream, SHOOT'], ['Rakk have attacks that are impossible to avoid'], ['The strategy that works best for me is to run backwards while aiming to the entire flock', 'There might be a better option based on your character class AND skills', 'This is quite class-agnostic', ""Rather than dodging, don't give them the chance to approach you"", 'Some rapid fire weapon (i.e. any good Vladof gun) should dispose of them easily', 'If they get close, switch to a shotgun', 'Trying to use weapons that have higher spreads should allow you to shred through rakk quickly', 'You want a shotgun, SMG, or assault rifle, watch your minimap to see where rakks are coming from, and pour fire downrange', 'Avoid using snipers or rocket launchers', 'Shotguns work great against rakk', 'Any rapid-firing weapon should be sufficient to take rakk down'], ['Equip a spike shield which damages all melee attackers', 'The Rakks will kill themself when they attack you', ""When you have a good shield and they aren't too high-level, their first attack will be their last one""], ['You can always equip a shield that provides elemental damage (such as a Maliwan Spike shield)'], [""If you're in open space, getting a vehicle makes life easier""], ['Later-game rakk flocks seem to be a lot more aggressive'], ['A well-timed melee attack will also take rakk down'], ['Getting against a wall is less effective but still useful'], ['If you can get to somewhere with overhead cover, that will often prevent rakks from getting an attack run in']]"
stack,1,Word for cheating off of another person's test in class,"[['The 2009 CRCT statistics are overwhelming and allow for no conclusion other than widespread cheating in APS', 'Cheating scandals are not rare enough', ""Organized, systematic cheating will continue as long as we're invested in the illusion that the system is working"", ""Governor's Report Details Widespread, Organized Cheating In Atlanta Schools"", 'Dr. John Fremer said there was widespread, organized cheating in APS', 'There is no single word for widespread or organized cheating', 'Organized, systematic cheating is the inevitable result of attaching high stakes to standardized tests'], [""For an entire group of students passing answers to one another in an organized effort, I can not think of anything more apt than 'mass-cheating'"", 'I was looking for something more specific to my scenario', 'To copy something from someone is the best thing I can come up with', ""To copy something from someone does still convey that what's being done is wrong and essentially cheating"", ""You'd probably want a different word such as 'copying' for other cases"", 'Cheat and/or copy is perfectly appropriate', 'A student cheated during math tests by copying from the student beside him', ""It will be difficult to find a single word that covers every situation, other than 'cheating' or a synonym"", ""I could simply use the word 'cheating' here""], ['collusion does carry the proper connotation', 'conspiracy can work', ""I would go for 'conspiring' if the students are knowingly and deliberately working together""], [""Mark is acting without Peter's knowledge/approval""], ['Harvard officials called it the biggest such probe in living memory'], ['The probe involves about 125 students over cheating on a take-home exam for the course, called Introduction to Congress'], ['This qualifies as plagiarism per OED def. 1']]"
stack,2,"When, if ever, are dried herbs preferable to fresh herbs?","[[""If you are going to substitute, you'll need to add more (typically about 3x as much, as the dry is usually more concentrated)"", 'I always use roughly 25% more', 'When substituting you typically need to add much more of the herb', ""One exception to the rule is bay leaves -- you'll still need to add them early, and you'll want to reduce the number"", 'When using fresh in place of dried use slightly more'], [""If you need to supercharge a dish but don't want to change the color, use dried herbs""], [""Getting a piece of dried herb that hasn't had time to hydrate & soften can be really offputting to eat""], [""When you're dealing with winter dishes, dry herbs would've been the norm to have used at that time"", 'I tend to go fresh whenever possible', 'Fresh herbs generally have short storage times', 'My advice is to make the decision on a herb by herb basis.', ""You'll want to add it late in the cooking process, while dry herbs are usually added early"", 'Dried herbs are mostly useful for longer cooking dishes', 'Fresh herbs can be useful for outer seasoning, too', 'Certain herbs are very mild when fresh and do not develop their full smell and flavour until dried', 'There may be a benefit in using dried herbs with some recipes', 'When using fresh in place of dried, add later in the cooking process if possible', 'Fresh herb flavor is more delicate', 'Dry rubs are a great use for dried herbs', 'If you want the flavor to infuse into the dish you will need to use dried herbs', 'Choosing one or the other can depend on how long a dish is cooking', 'Heating herbs can discolor herbs', ""The main advantage to dry herbs is that they're available year round"", 'There is no one rule that holds all when it comes to dry/fresh herbs.'], ['It’s however not common to find freeze dried herbs in regular shops.', 'Freeze drying often maintains flavours of the fresh herb more.'], ['When using dried, crush them first'], ['You get layers of flavor, not just top notes'], ['Dry rubs are one case where dry is specifically necessary'], ['Fresh herbs can be pureed to a paste and used under the skin']]"
stack,3,Is it a bad idea to attach my strap just above the nut?,"[['We players tend to have the straps anchor the pot itself', ""We don't want to expose our necks to stress"", ""It shouldn't harm the guitar"", 'Mine has had no ill effects from having its strap attached to the headstock', 'It is most comfortable to have the left end of the strap attached to just above the nut on the neck', ""I wouldn't recommend that you attach your strap that way for a heavy banjo (especially if it has a long neck)"", ""For 'sideways warp' there are no correction mechanisms"", 'Balance the circle (pot) so that the neck naturally hangs where you need it', 'We never put a strap on the neck near the nut', 'You can indeed attach the strap to the neck or headstock for a very lightweight banjo with a thick neck', 'Altering the strap attachment will change the way the guitar hangs', 'The neck is light enough to be balanced by the pot, itself', ""The heavier the instrument and the slimmer (in the direction across the strings) and longer the neck, the more effect the 'unexpected' forces can deal out"", 'For a guitar attaching your strap that way would not be such a big deal', 'Necks tend to be thin and primarily designed to deal with the forces of the strings', 'Hanging the whole instrument from necks adds stress quite in a different direction and outside of its design', 'I worry that attaching the strap just above the nut on the neck is putting stress on the neck', 'If the neck naturally hangs low, snug the left strap farther along on the circumference of the pot hooks', 'You choose the hooks to attach to based on the ones that leave your neck at a natural angle when the pot is hanging in front of you']]"
stack,4,Are there any microbrewery in Lisbon/Tomar in portugal?,"[['Portugal is not really known for their beer', ""Beer doesn't end up shining in any significant way in the region""], ['What is the specialty brew in Portugal?', 'Is there any special beer or beer-like alcohol from Portugal?'], ['Dois Corvos and Oitava Colina are both craft breweries in the area', 'There is a chain restaurant over in Portugal called Cervejeira Lusitana; also known as the Lusitanian Brewery', 'Quimera Brewpub in Rua Prior do Crato, Lisbon is a place to consider', 'There should be a few Cervejeira Lusitana in Lisbon', 'Are there any microbrewery in Lisbon/Tomar in Portugal?', 'The two craft breweries in Lisbon are Dois Corvos and Oitava Colina'], ['Dois Corvos has a tasting room a couple km from the centre'], ['Both make good beer'], ['We bought some American Pale Ale (4,9 %) and some Rye IPA (6,8 %).', 'The American Pale Ale and Rye IPA are very nice.'], ['The microbrewery makes some really good brews in today’s IPA trend.'], ['The shop provides some products to home brewers.'], ['It returns 4 breweries'], ['I would ask around and see if any of the locals know of any particular bars and brews to try']]"
stack,5,Was Rogue One not a Star Wars Episode movie?,"[['Producer Kathleen Kennedy was very supportive of Gareth Edwards’ desire to experiment and to give the film its own unique personality', ""Director Gareth Edwards puts own stamp to Star Wars with 'Rogue One'""], ['The basis for Rogue One is the tale of how the Rebellion acquires the Death Star plans in Episode IV and discusses why there was such a major flaw in the design of the Death Star', 'Rogue One is absolutely a Star Wars movie.', ""Rogue One is not a movie such that it is deemed 'Episode x'."", 'Rogue One adds to the main story (being a side arc), it is not truly part of it', ""Rogue One is not an 'Episode' of the Star Wars saga"", 'The film and the other standalone films are separate and distinct from the Star Wars Saga films', ""Rogue One is 'just' an anthology film"", 'The anthology films give us more information about plot points and characters we have only been able to speculate about and expand the galaxy', ""The difference between these films and the Episodes is that they don't further the plot of the Skywalker family and the story of the Jedi"", 'Rogue One is a stand-alone film set in the Star Wars universe', ""'Episode 3½' would be kind of a stupid title."", 'Rogue One is part of the Star Wars Anthology Series which was planned after the decision to make the Sequel Trilogy', 'If you want to know the main story, Rogue One is not required to see', 'Rogue One simply fills the gap in knowledge of what happened between Episode III and Episode IV, rather than further the plot of the Episodes so far'], ['With the standalone films we’re relaxing some of those rules so that we can try stylistic and tonal experiments that depart a bit from what we’ve seen and are exciting'], ['The Star Wars saga films have a responsibility to maintain a continuity of tone and stylistic device']]"
stack,6,"Is saying ""I have checked futilely"" correct?","[[""calling each individual check 'futile' contradicts your end result"", 'I found a store with what I needed', 'futility is generally an all-encompassing thing', ""searching for something but never finding it, or going out to search for something that doesn't actually exist, or for something that is no longer in the area you're searching is genuinely futile"", ""If you prefer futile, it would sound better as: 'After a futile search through several stores, I finally found a store that had what I needed.'""], [""It's technically correct"", 'The first answer is grammatically correct'], ['Your sentence is OK but awkward.', 'My search was futile or the futility of my search are the more standard phrasings using variants on futile', 'The first answer sounds awkward'], ['After checking a few stores fruitlessly, I found a store with what I needed is an alternative'], [""You can't really make futile a 'ly', because of the chronological implications""]]"
stack,7,Which ATMs offer no-fee cash withdrawals in Chile?,"[[""I am concerned that the ATM's bank might charge me fees for withdrawals""], [""my girlfriend, who does have a card from a bank in a different country to mine, does get charged (and told she will), by ATMs that don't charge me""], ['ATM withdrawal fees depend not on the bank, but on the ATM', 'A Banco Security ATM is what you need', 'Banco Estado charges 4000clp at ATMs around Rancagua', 'Banco Security at Apoquindo 3150, Las Condes, Región Metropolitana does not charge an ATM fee', 'Banco Security still does not have a fee', 'Banco Estado does charge the 4000CLP fee', 'Banco Security is still free of fees', 'CorpBanca / Itaú charges 3000clp or 5000clp at ATMs around Rancagua', 'BBVA charges 4100clp at ATMs around Rancagua', 'Banco de Chile / Banco CrediChile charges 3500clp or 5000clp at ATMs around Rancagua', 'BCI charges 4738clp at ATMs around Rancagua', 'Scotiabank charges 3500clp at ATMs around Rancagua', ""Banco Security's ATM in Centro (Agustinas-Moneda) now charges a 5000 CLP fee"", 'Santander / Banefe charges 5000clp at ATMs around Rancagua', 'I was able to withdraw money without the ATM charges today from a Banco Security ATM'], ['The Las Condes location always has a working-ATM during business hours'], ['Wells Fargo card charges 5usd for ATM withdrawals'], ['You can withdraw safely at the ATM inside the agency at Agustinas 621, Santiago (station Santa Lucia - line 1)'], ['Banco BICE charges 2500clp at ATMs around Rancagua'], ['Banco Falabella ATMs could not give me any money with my card'], ['Banco Security in Santiago Centro has only been available occasionally when I visited'], ['BICE does not have a fee'], ['Banco Internacional does not have a fee'], ['Banco Security in Las Condes is probably not different']]"
stack,8,"Is there as more positive sounding word to use in place of 'viral' or 'contagious', in regard to an idea or campaign?","[[""'Spread' is better"", ""'Viral' and 'contagious' do not sound right for the campaign""], [""There is nothing negative about the term 'viral' when the context is music, communication or the Internet."", ""A campaign that has become 'viral' on Twitter is a successful campaign."", ""the metaphorical use of 'viral' has become so widespread that it doesn't really carry negative connotations from its literal meaning""], ['Flourish is to develop rapidly and successfully', 'Our campaign is burgeoning', 'Thrive, Flourish, Bloom come to mind', 'Exponential means increasingly rapid', 'Snowball means to increase rapidly in size, intensity, or importance'], ['Memetic means essentially the same thing as viral'], ['The campaign is publicising the idea that', 'The campaign is letting out the idea that'], ['The campaign is spreading like wild fire', 'this idea has already caught on', ""when you're talking about a message or idea, rather than a fad or funny video, you want your idea to catch on""], ['Resonate is often used to describe ideas that people like and spread', 'Resonate means that a sound gets stronger and stronger as it echoes']]"
stack,9,What should I do with a just-baked lasanga?,"[[""You shouldn't put hot lasagna directly into the fridge"", 'Reheat lasagna at 350 for 1/2 hour before serving', 'lasagna can simply be re-heated 30 minutes before serving', 'If it is a dish you cannot put in oven while so cold, leave it 1/2 hour at room and 30 minutes at 325°F (160°C)', 'Keep lasagna above 70C (160F)', 'If lasagna is cool already you could also use cling film for the wrapping', 'How should I re-heat lasanga, if it will be required', 'You can re-heat the lasagna all at once in a low temperature (250°F or so) oven, or cut into individual servings and microwave it', 'It will probably only be eaten 3-4 hours from now', 'First leave the dish at room temperature for 30 minutes so you can then put it in the fridge', 'It would be fine to leave lasagna in the oven until your guest arrive with the oven turned off after baking', 'You should let the lasagna cool for a little while, maybe even let it sit on some ice, then refrigerate', 'You cannot easily cool and reheat a decent sized lasagna in 3 to 4 hours and get down to 4C for any length of time to make it worthwhile', 'What should I do with lasanga in the mean while', 'The correct answer is to wrap lasagna with aluminium foil and stick lasagna in the fridge', 'You need to get the lasagna cold now', 'You could also consider leaving the oven on low, and keeping lasagna hot till serving time', 'Cover the dish tight with foil', 'If you leave the oven door closed it will stay clean and warm for a few hours'], ['I would just leave lasagna on the table', 'The lasagna will be even better 4 hours from now'], ['You could under-cook lasagna slightly to allow for this'], ['I just made a lasanga from a recipe - or something that looks like a lasanga', 'Make sure you have a dish that can take going from cold fridge to hot oven'], ['One hour before eat time reheat the dish in oven at 300 degrees Fahrenheit (150 Celsius) for one hour']]"
stack,10,How can I strengthen my fretting hand away from my guitar?,"[['The issue with the ring finger following the middle finger is a question of independence or maybe flexibility', 'Finger exercises by Greg Irwin require absolutely no extra equipment, other than the digits that nature has equipped us with', 'Something like the Planet Waves Varigrip should help you out', 'You can build your own dexterity exercises from the examples', 'A simple soft rubber ball can do the job', 'Going through an old newspaper or flyer from the mail sheet by sheet rolling them into a ball as fast and hard as I can (alternating between each hand) really does a number on my forearms and fingers', 'I use the product line called Grip Master', 'You will want to push with each finger one at a time so you build up each finger itself', 'You squeeze and release a simple soft rubber ball slowly gripped in your fret board hand', 'Squeezing and releasing a simple soft rubber ball slowly helps build strength in the hand muscles you use to fret your guitar', 'The Finger Fitness exercises by Greg Irwin are good for finger independence and swiftness', ""Any learner of any musical instrument should take a look at Greg Irwin's finger exercises"", 'It does increase strength', ""There are exercises I can do while I don't have my guitar that can help improve the strength of my fingers, especially my ring and pinky fingers"", 'There are exercises I can do to help me move my fingers independently of each other', 'I have had luck with the Grip Master (and other derivatives) series of hand exercisers'], ['The fret hand requires stamina more than raw strength'], ['You should try to hold it for a certain amount of time'], [""Don't spring for the heaviest tension exerciser they have""], ['Repetition is key to a musical instrument'], ['Many of the exercises people have suggested will increase stamina too', 'Stamina is also a large factor'], ['The fingertip/small of thumb grip (Finger Tip Pinch) has worked best for me with guitar'], ['The warm-up time when playing is drastically reduced when used lightly beforehand'], ['Doing reps while holding the grip down for 3 to 5 seconds at a time is really where all the benefits come from'], [""I wouldn't buy Greg Irwin's whole DVD series""], ['Finger strength is not the crucial thing for almost any musical instrument'], ['Get a Powerball to train your fingers and hands'], ['Go with quality over quantity'], ['I always lose or misplace those grippie things you can buy at Guitar shops'], ['Too much of a good thing is bad with any sort of exercise']]"
stack,11,Should I use 'or' or 'nor' after a negative statement?,"[['or is correct in your example', ""'She didn’t speak slowly or clearly' has a better ring to it than 'She didn’t speak slowly nor clearly'"", 'This document covers neither the SDK interfaces nor any other reference material', ""I don't study French or Spanish is equivalent to Word's preference"", ""'He is not interested in math or science' is correct"", 'We should use ""or"" to link the noun phrases', 'Word interprets this as: This document does not cover [either] the SDK interfaces or any other reference material', 'We effectively ignore the ""not"" when considering the rest of the sentence structure', ""If the two options are negative (neither this nor that) then use 'nor'."", 'your original sentence is correct', 'This document does not cover the SDK interfaces nor any other reference material', ""when the second negative item is a noun, adjective, or adverb phrase, you should use 'or' to continue the negative thought"", ""I just keep Word's grammar checker turned off and rely on thorough proof-reading."", ""I don't study French nor Spanish is equivalent to your sentence"", ""when you use the word 'not,' the structure 'not A or B' is correct"", ""Your example sentence can be reworded to read, 'This document covers neither the SDK interfaces nor any other reference material.'"", 'This document does not cover the SDK interfaces, nor does it include any other reference material', 'to use nor is redundant', ""Word's grammar checker is mediocre at best."", ""I study neither French nor Spanish is equivalent to moioci's first rewrite"", ""Otherwise, use 'or'."", ""My grammatical checker in Microsoft Word underlines 'nor' and suggests 'or'""], [""if the second part of the negative is a verb phrase—not a verb clause—then you can choose to use 'nor' or 'or'""], [""if you’re unsure which word to use, or if you want to avoid the problem, you can try saying, 'and no' for the second part of the negative""], [""the phrase 'and not' will also work""], ['https://www.wikihow.com/Use-nor gives a thorough explanation of when to use nor']]"
stack,12,What is the metaphoric meaning of silo?,"[['A functional silo exists when the business processes of a functional unit within the division of labor of an organization focus inwardly on their functional objectives.', 'BPR recommends the removal of a function-focused approach and its replacement with a process-focused approach, thereby destroying the functional silos and encouraging cross-functional integration.', 'Something to do with fermenting seems to be missing in these explanations', ""the origin of the metaphor is the idea that grain silos don't communicate with each other"", ""This becomes problematic when the direction of focus creates barriers that do not serve a reasonable business purpose and negatively impacts the unit's ability to serve their role in the broader mission of the organization."", 'it is a rather strange metaphor for isolation', 'A term used within business process re-engineering (BPR) to denote areas within an organization where managers occupy a privileged position in terms of resources and influence, and where they use this for their own, self-interested, functionally-oriented motives rather than for the wider benefit of the business.', 'Silo is a metaphor', 'Process-oriented organizations break down the barriers of structural departments', 'A functional group or department within an organization acts as a silo or island in its lack of interaction with other groups and in not sharing its internal data or processes', 'There are people and groups in an organization that behave in the same way as silos', 'Process-oriented organizations try to avoid functional silos', ""It's a fermenting over time, away from the rest of the influences"", 'Poorly operated silos become structurally unsound and can lead to a collapse or worse', 'A functional silo in an organization or business is not inherently negative', 'silo is being used as a metaphor here, not an actual silo'], ['Certain high level communications are best made where tight controls are in place, limiting access'], ['Communications within a silo do take into account those outside the silo'], ['Any business including nonprofit organizations must be profitable to grow by adding new staff at all levels'], ['Silos are good when properly operated']]"
stack,13,Can I control the rate at which new prisoners arrive?,"[['You can open or close prisoner security categories (min, normal, max)', 'You can use the Intake tab to control the number prisoners you receive every day as well as the percentage of minimum/medium/maximum security prisoners you get', 'Alpha 30 has added a new Intake report tab', 'If you close all prisoner security categories, you will receive no prisoners that day'], ['You now receive a fixed daily grant of $150 per prisoner, regardless of category', 'You now receive a one-off payment for each inmate you accept into your prison', 'Alpha 30 changed the way you get paid for inmates'], ['You still need a delivery area, though, so move it further away from the road.', 'You CAN avoid gaining new prisoners by removing your delivery area next to the road.'], ['Your holding cell now counts for how many prisoners you can hold.'], ['In Alpha 2, any new prisons you create have an option to only send prisoners when you have room for them.', 'there is an option when creating a new prison to have new prisoners sent only when there are cells for them'], ['Alpha 30 removed the Continuous Intake option when making a new prison'], ['I want to build a prison that lasts'], ['For anyone using a save game from Alpha 1, this trick still works.'], [""You can open up the save file with Notepad or something and change 'Intake.numPrisoners' to whatever you want (Greater than 0, Less than 1000000)""]]"
